25025115;METIERS DE L'INDUSTRIE : CONCEPTION DE PRODUITS INDUSTRIELS (LP LE MANS);RNCP30125;Niveau 6;Licence Professionnelle;v1.0;oui;01/01/2025;ACTIVE
1351281M;DROIT PRIVE (MASTER);RNCP34123;Niveau 7;MASTER;v1.0;oui;31/08/2024;ACTIVE
46X22702;TECHNICIEN(NE) DE MAINTENANCE EN GENIE CLIMATIQUE (LYCEE MAXIMILEN PERRET - GRETA MTI);RNCP28743;Niveau 4;;v1.0;oui;05/08/2022;INACTIVE
25012811;ACTIVITES JURIDIQUES : METIERS DU DROIT PRIVE (LP);RNCP30039;Niveau 6;Licence Professionnelle;v1.0;oui;01/01/2025;ACTIVE
17022706;INGENIEUR DIPLOME DE L'ECOLE NATIONALE SUPERIEURE DES MINES DE SAINT-ETIENNE DE L'INSTITUT MINES-TELECOM SPE ENERGETIQUE;RNCP18936;Niveau 7;Titre ingénieur;v1.0;oui;01/01/2025;ACTIVE
32022318;CONCEPTION DES PROCESSUS DE REALISATION DE PRODUITS OPTION A PRODUCTION UNITAIRE (BTS);RNCP37464;Niveau 5;BTS;CI-09112023;oui;31/08/2027;ACTIVE
2503122S;COMMERCE ET DISTRIBUTION (LP NANTES);RNCP29740;Niveau 6;Licence Professionnelle;v1.0;oui;01/01/2025;ACTIVE
13531330;FINANCE (MASTER GRENOBLE ALPES);RNCP35913;Niveau 7;MASTER;v2.1;oui;31/08/2026;ACTIVE
26X31309;GESTIONNAIRE D'ACTIFS ET DE PATRIMOINES IMMOBILIERS (SCIENCES-U LILLE LYON ET PARIS);RNCP37838;Niveau 6;;CI-09112023;oui;19/07/2026;ACTIVE
56T24301;PIQUEUR EN MAROQUINERIE (TP);RNCP17031;Niveau 3;TP;v1.0;oui;09/06/2023;INACTIVE
25032037;METIERS DU NUMERIQUE : CONCEPTION, REDACTION ET REALISATION WEB (LP PERPIGNAN);RNCP29971;Niveau 6;Licence Professionnelle;v1.0;oui;01/01/2025;ACTIVE
25022250;INDUSTRIES PHARMACEUTIQUES, COSMETOLOGIQUES ET DE SANTE : GESTION, PRODUCTION ET VALORISATION (LP CAEN);RNCP30075;Niveau 6;Licence Professionnelle;v1.0;oui;01/01/2025;ACTIVE
2502002R;METIERS DE L'INDUSTRIE : GESTION DE LA PRODUCTION INDUSTRIELLE (LP BORDEAUX);RNCP30128;Niveau 6;Licence Professionnelle;v1.0;oui;01/01/2025;ACTIVE
25025019;MAINTENANCE ET TECHNOLOGIE : SYSTEMES PLURITECHNIQUES (LP LE MANS);RNCP30092;Niveau 6;Licence Professionnelle;v1.0;oui;01/01/2025;ACTIVE
16X20009;MANAGER DE LA PERFORMANCE DE LA SUPPLY-CHAIN (ESTIA);RNCP36081;Niveau 7;;v2.4;oui;15/12/2023;INACTIVE
25131206;TECHNIQUES DE COMMERCIALISATION : STRATEGIE DE MARQUE ET EVENEMENTIEL (BUT);RNCP35358;Niveau 6;BUT;v1.7;oui;31/08/2026;ACTIVE
56033103;AUXILIAIRE DE PUERICULTURE (DIPLOME D'ETAT);RNCP35832;Niveau 4;DE;v2.0;oui;01/09/2025;ACTIVE
25032029;METIERS DE LA COMMUNICATION : CHARGE DE COMMUNICATION (LP LA REUNION);RNCP30101;Niveau 6;Licence Professionnelle;v1.0;oui;01/01/2025;ACTIVE
42032305;BREVET ARTISTIQUE DES TECHNIQUES DU CIRQUE (DIPLOME);RNCP23909;Niveau 4;Autre;v1.0;oui;01/01/2025;ACTIVE
50032222;METIERS DE LA GRAVURE OPTION C : GRAVURE EN MODELE (CAP);RNCP622;Niveau 3;CAP;v1.0;oui;01/01/2025;ACTIVE
13531358;FINANCE (MASTER STRASBOURG);RNCP35913;Niveau 7;MASTER;v2.1;oui;31/08/2026;ACTIVE
42024210;TECHNICIEN DES METIERS DU SPECTACLE OPTION TECHNIQUES DE L'HABILLAGE (DIPLOME);RNCP1136;Niveau 4;Autre;v1.0;oui;01/01/2025;ACTIVE
32033423;MANAGEMENT EN HOTELLERIE-RESTAURATION OPTION A MANAGEMENT D'UNITE DE RESTAURATION (BTS);RNCP37889;Niveau 5;BTS;CI-09112023;oui;31/08/2028;ACTIVE
1703260Q;INGENIEUR DIPLOME DE L'ECOLE NATIONALE SUPERIEURE D'INFORMATIQUE ET DE MATHEMATIQUES APPLIQUEES DE L'INSTITUT POLYTECHNIQUE DE GRENOBLE;RNCP12735;Niveau 7;Titre ingénieur;v1.0;oui;01/01/2025;ACTIVE
13532632;INGENIERIE DES SYTEMES COMPLEXES (MASTER PARIS 12);RNCP34026;Niveau 7;MASTER;v1.0;oui;31/08/2024;ACTIVE
46T23302;PEINTRE DECORATEUR (TP);RNCP37476;Niveau 4;TP;v1.0;oui;01/08/2024;ACTIVE
50023320;SOLIER-MOQUETTISTE (CAP);RNCP35196;Niveau 3;CAP;v1.6;oui;31/08/2024;ACTIVE
23633502;DIPLOME D'ETAT SUPERIEUR DE LA JEUNESSE, DE L'EDUCATION POPULAIRE ET DU SPORT SPE PERFORMANCE SPORTIVE (DES JEPS);RNCP36040;Niveau 6;DESJEPS;v2.2;oui;31/12/2026;ACTIVE
1353261R;TRAITEMENT DU SIGNAL ET DES IMAGES (MASTER);RNCP23347;Niveau 7;MASTER;v1.8;oui;01/01/2025;ACTIVE
36X32206;CONCEPTEUR GRAPHIQUE (ECOLE PRESQU'ILE);RNCP34685;Niveau 5;;v2.3;oui;29/06/2023;INACTIVE
50022714;INSTALLATEUR EN FROID ET CONDITIONNEMENT D'AIR (CAP);RNCP31334;Niveau 3;CAP;v1.0;oui;01/01/2025;ACTIVE
50023443;CONDUCTEUR-OPERATEUR DE SCIERIE (CAP);RNCP37304;Niveau 3;CAP;v2.9;oui;31/08/2028;ACTIVE
25033507;ANIMATION, GESTION ET ORGANISATION DES ACTIVITES PHYSIQUES ET SPORTIVES (LP POITIERS);RNCP35947;Niveau 6;Licence Professionnelle;v2.1;oui;31/08/2026;ACTIVE
20512801;ADMINISTRATION ECONOMIQUE ET SOCIALE (LIC LMD POITIERS);RNCP35923;Niveau 6;LICENCE;v2.1;oui;31/08/2026;ACTIVE
50023217;MACON (CAP);RNCP35715;Niveau 3;CAP;v1.9;oui;31/08/2026;ACTIVE
46T25507;CHARGE DE TRAVAUX EN RESEAUX ELECTRIQUES AERIENS ET SOUTERRAINS (TP);RNCP35825;Niveau 4;TP;v2.1;oui;20/11/2026;ACTIVE
50023221;MARBRIER DU BATIMENT ET DE LA DECORATION (CAP);RNCP16128;Niveau 3;CAP;v1.0;oui;01/01/2025;ACTIVE
16X31013;EXPERT EN INTELLIGENCE ECONOMIQUE (ESLSCA);RNCP34803;Niveau 7;;v1.3;oui;23/07/2025;ACTIVE
32124101;TEXTILES ET CERAMIQUES OPTION : ARTS TEXTILES (DMA);RNCP840;Niveau 5;DMA;v1.0;oui;01/01/2025;ACTIVE
25033212;METIERS DE L'ANIMATION SOCIALE SOCIO-EDUCATIVE ET SOCIOCULTURELLE (LP NICE);RNCP30116;Niveau 6;Licence Professionnelle;v1.1;oui;01/01/2025;ACTIVE
32023109;GEOLOGIE APPLIQUEE (BTS);RNCP35337;Niveau 5;BTS;v1.6;oui;01/01/2024;ACTIVE
26X31236;CHARGE DE GESTION COMMERCIALE (FORMATIVES);RNCP34465;Niveau 6;;v1.2;oui;02/03/2025;ACTIVE
45022202;CONDUCTEUR D'APPAREILS DES INDUSTRIES CHIMIQUES (BP);RNCP418;Niveau 4;BP;v1.0;oui;01/01/2025;ACTIVE
32020114;METIERS DE L'EAU (BTS);RNCP37964;Niveau 5;BTS;CI-09112023;oui;31/08/2028;ACTIVE
1702010S;INGENIEUR DIPLOME DE L'ECOLE NATIONALE SUPERIEURE DE PHYSIQUE, ELECTRONIQUE, MATERIAUX DE L'INSTITUT POLYTECHNIQUE DE GRENOBLE, SPECIALITE MICROELECTRONIQUE ET TELECOMMUNICATIONS;RNCP37840;Niveau 7;Titre ingénieur;CI-09112023;oui;31/08/2025;ACTIVE
25022160;METIERS DE LA SANTE : NUTRITION, ALIMENTATION (LP);RNCP30113;Niveau 6;Licence Professionnelle;v1.0;oui;01/01/2025;ACTIVE
13531431;CONTROLE DE GESTION ET AUDIT ORGANISATIONNEL (MASTER ORLEANS);RNCP35918;Niveau 7;MASTER;v2.1;oui;31/08/2026;ACTIVE
17011202;INGENIEUR DIPLOME DE L'ECOLE NATIONALE SUPERIEURE DE TECHNOLOGIE DES BIOMOLECULES DE BORDEAUX DE L'INSTITUT POLYTECHNIQUE DE BORDEAUX;RNCP36430;Niveau 7;Titre ingénieur;v2.6;oui;31/08/2026;ACTIVE
15531003;DIPLOME GRADE MASTER DE PARIS DAUPHINE : MANAGEMENT GENERAL;RNCP27422;Niveau 7;DGE_GM;v1.0;oui;31/08/2019;INACTIVE
13512885;DROIT, ECONOMIE, GESTION : DROIT DES AFFAIRES (MASTER SAINT ETIENNE);RNCP34127;Niveau 7;MASTER;v1.0;oui;31/08/2024;ACTIVE
13511204;CHIMIE MOLECULAIRE (MASTER COMUE COTE D'AZUR);RNCP32150;Niveau 7;MASTER;v1.0;oui;01/01/2025;ACTIVE
13534008;ADMINISTRATION PUBLIQUE (MASTER MONTPELLIER);RNCP34130;Niveau 7;MASTER;v1.0;oui;31/08/2024;ACTIVE
50022430;SOUFFLEUR DE VERRE OPTION VERRERIE SCIENTIFIQUE (CAP);RNCP6603;Niveau 3;CAP;v1.0;oui;01/01/2025;ACTIVE
46125402;TECHNICIEN(NE) EN TUYAUTERIE (CS4);RNCP38312;Niveau 4;MC4;CI-30112023;oui;31/10/2027;ACTIVE
32123006;DECOR ARCHITECTURAL OPTION D : DOMAINE DES MATERIAUX DE SYNTHESE (DMA);RNCP844;Niveau 5;DMA;v1.0;oui;01/01/2025;ACTIVE
36X23002;DESSINATEUR EN BATIMENT ARCHITECTURE (EDAIC);RNCP36875;Niveau 5;;v2.8;oui;29/09/2024;ACTIVE
25033452;METIERS DES ARTS CULINAIRES ET DES ARTS DE LA TABLE (LP);RNCP29978;Niveau 6;Licence Professionnelle;v1.0;oui;01/01/2025;ACTIVE
1353261P;MATHEMATIQUES ET INFORMATIQUE APPLIQUEES AUX SCIENCES HUMAINES ET SOCIALES - MIASHS (MASTER);RNCP34220;Niveau 7;MASTER;v1.0;oui;31/08/2024;ACTIVE
17022502;INGENIEUR DIPLOME DE L'ECOLE NATIONALE SUPERIEURE MINES-TELECOM LILLE DOUAI DE L'INSTITUT MINES-TELECOM, SPECIALITE PLASTURGIE ET MATERIAUX COMPOSITES;RNCP35817;Niveau 7;Titre ingénieur;v2.1;oui;31/08/2024;ACTIVE
50023005;MONTEUR DE STRUCTURES MOBILES (CAP);RNCP37942;Niveau 3;CAP;CI-09112023;oui;31/08/2026;ACTIVE
40032304;PHOTOGRAPHIE (BAC PRO);RNCP37233;Niveau 4;BAC PRO;v2.9;oui;31/08/2027;ACTIVE
25020042;QUALITE, HYGIENE, SECURITE, SANTE, ENVIRONNEMENT (LP AMIENS);RNCP30098;Niveau 6;Licence Professionnelle;v1.0;oui;01/01/2025;ACTIVE
16X32028;EXPERT EN CONCEPTION NUMERIQUE, ANIMATION 3D ET EFFETS SPECIAUX (ISART DIGITAL);RNCP36132;Niveau 7;;v2.5;oui;26/01/2025;ACTIVE
40023404;TECHNICIEN CONSTRUCTEUR BOIS (BAC PRO);RNCP37916;Niveau 4;BAC PRO;CI-09112023;oui;31/08/2026;ACTIVE
13531550;GESTION DES RESSOURCES HUMAINES (MASTER);RNCP35912;Niveau 7;MASTER;v2.1;oui;31/08/2026;ACTIVE
17032621;INGENIEUR DIPLOME DE L'ECOLE NATIONALE SUPERIEURE MINES-TELECOM ATLANTIQUE BRETAGNE PAYS DE LA LOIRE DE L'INSTITUT MINES-TELECOM SPECIALITE RESEAUX ET TELECOMMUNICATION;RNCP16666;Niveau 7;Titre ingénieur;v1.2;oui;01/01/2025;ACTIVE
26033401;DIPLOME EN MANAGEMENT DU TOURISME ET DE L'HOTELLERIE D'EXCELIA GROUP;RNCP36321;Niveau 6;DIPLOVIS;v2.0;oui;31/08/2025;ACTIVE
25031379;ASSURANCE, BANQUE, FINANCE : CHARGE DE CLIENTELE (LP CHAMBERY);RNCP30181;Niveau 6;Licence Professionnelle;v1.0;oui;01/01/2025;ACTIVE
17021003;INGENIEUR DIPLOME DE L'ECOLE NATIONALE SUPERIEURE D'AGRONOMIQUE DE TOULOUSE, DE L'INSTITUT NATIONAL POLYTECHNIQUE DE TOULOUSE (ENSAT);RNCP37297;Niveau 7;Titre ingénieur;v2.9;oui;31/08/2025;ACTIVE
46125403;TECHNICIEN(NE) EN CHAUDRONNERIE AERONAUTIQUE ET SPATIALE (CS4);RNCP38224;Niveau 4;MC4;CI-30112023;oui;30/09/2028;ACTIVE
45023314;METIERS DU PLATRE ET DE L'ISOLATION (BP);RNCP38309;Niveau 4;BP;CI-30112023;oui;31/12/2028;ACTIVE
32132301;CIRQUE (DMA);RNCP838;Niveau 5;DMA;v1.6;oui;01/01/2025;ACTIVE
45033607;ESTHETIQUE COSMETIQUE PARFUMERIE (BP);RNCP34671;Niveau 4;BP;v1.3;oui;31/08/2024;ACTIVE
26X32610;ADMINISTRATEUR(TRICE) DE SYSTEMES D'INFORMATION (IP-FORMATION);RNCP34206;Niveau 6;;v1.0;oui;10/09/2024;ACTIVE
17020044;INGENIEUR DIPLOME DE L'ECAM-EPMI;RNCP16044;Niveau 7;Titre ingénieur;v1.6;non;01/01/2025;ACTIVE
35031201;TECHNIQUES DE COMMERCIALISATION  (DUT);RNCP2927;Niveau 5;DUT;v1.0;oui;01/01/2024;ACTIVE
36X25203;PREPARATEUR DEVELOPPEUR DE VEHICULES DE COMPETITION (ECOLE DE LA PERFORMANCE);RNCP34401;Niveau 5;;v2.4;oui;27/01/2025;ACTIVE
1353100Y;CONTROLE DE GESTION ET AUDIT ORGANISATIONNEL (MASTER EVRY);RNCP35918;Niveau 7;MASTER;v2.1;oui;31/08/2026;ACTIVE
13534105;URBANISME ET AMENAGEMENT (MASTER MARNE LA VALLEE);RNCP31470;Niveau 7;MASTER;v1.0;oui;01/01/2025;ACTIVE
36033207;EDUCATEUR DE JEUNES ENFANTS (DIPLOME D'ETAT);RNCP37679;Niveau 6;DE;v1.3;oui;31/08/2026;ACTIVE
13531092;MANAGEMENT DE L'INNOVATION (MASTER GRENOBLE ALPES);RNCP35910;Niveau 7;MASTER;v2.1;oui;31/08/2026;ACTIVE
26531201;DIPLOME SUPERIEUR DE MANAGEMENT INTERNATIONAL (EX : INBA) DE SCBS;RNCP35999;Niveau 6;DipViGrL;v2.5;oui;31/08/2025;ACTIVE
25020148;SYSTEMES AUTOMATISES, RESEAUX ET INFORMATIQUE INDUSTRIELLE (LP TOULOUSE 3);RNCP29972;Niveau 6;Licence Professionnelle;v1.0;oui;01/01/2025;ACTIVE
17022704;INGENIEUR DIPLOME DE L'INSTITUT NATIONAL DES SCIENCES APPLIQUEES DE ROUEN, SPECIALITE GENIE ENERGETIQUE;RNCP21923;Niveau 7;Titre ingénieur;v1.0;oui;01/01/2025;ACTIVE
13522220;SCIENCES DU MEDICAMENT (MASTER PARIS SACLAY);RNCP34442;Niveau 7;MASTER;v1.0;oui;31/08/2024;ACTIVE
2502001N;QUALITE, HYGIENE, SECURITE, SANTE, ENVIRONNEMENT (LP BODEAUX);RNCP30098;Niveau 6;Licence Professionnelle;v1.0;oui;01/01/2025;ACTIVE
16X20006;MANAGER DE PROJET D'INNOVATION (ITECH-LYON);RNCP32124;Niveau 7;;v1.6;oui;04/01/2024;ACTIVE
2502000H;METIERS DE L'INDUSTRIE : CONCEPTION ET AMELIORATION DE PROCESSUS ET PROCEDES INDUSTRIELS (LP BORDEAUX);RNCP30126;Niveau 6;Licence Professionnelle;v1.0;oui;01/01/2025;ACTIVE
32022002;TECHNIQUES PHYSIQUES POUR L'INDUSTRIE ET LE LABORATOIRE (BTS);RNCP35803;Niveau 5;BTS;v2.0;oui;31/08/2026;ACTIVE
16X32024;CONCEPTEUR REALISATEUR GAME EN ART (NEW 3D GENERAL EDUCATION);RNCP30731;Niveau 7;;v1.3;non;24/05/2021;INACTIVE
1351281P;DROIT SOCIAL (MASTER);RNCP38160;Niveau 7;MASTER;CI-27112023;oui;31/12/2028;ACTIVE
1353102A;COMMUNICATION DES ORGANISATIONS (MASTER POITIERS);RNCP32276;Niveau 7;MASTER;v1.0;oui;01/01/2024;ACTIVE
46125404;TECHNICIEN(NE) EN PEINTURE AERONAUTIQUE (CS4);RNCP37923;Niveau 4;MC4;CI-30112023;oui;31/08/2028;ACTIVE
20533507;SCIENCES ET TECHNIQUES DES ACTIVITES PHYSIQUES ET SPORTIVES (LIC LMD PARIS 11);RNCP35946;Niveau 6;LICENCE;v2.1;oui;31/08/2026;ACTIVE
26532605;SECURITE DU NUMERIQUE (BACHELOR EN SCIENCES ET INGENIERIE EPITA);RNCP37708;Niveau 6;Grade_Licence;CI-09112023;oui;31/08/2025;ACTIVE
26X33502;RESPONSABLE MARKETING ET EVENEMENTIEL SPORT (CQFD - AMOS);RNCP34317;Niveau 6;;v1.3;oui;18/11/2024;ACTIVE
25025107;METIERS DE L'INDUSTRIE : CONCEPTION ET PROCESSUS DE MISE EN FORME DES MATERIAUX (LP STRASBOURG);RNCP30127;Niveau 6;Licence Professionnelle;v1.0;oui;01/01/2025;ACTIVE
25033450;ORGANISATION ET GESTION DES ETABLISSEMENTS HOTELIERS ET DE RESTAURATION (LP);RNCP29985;Niveau 6;Licence Professionnelle;v1.0;oui;01/01/2025;ACTIVE
36321204;AUTOMATISME ET GESTION TECHNICO-ECONOMIQUE INFORMATISEE EN ELEVAGE LAITIER (CSA);NR;NR;NR;v2.0;NR;;INACTIVE
26031202;DIPLOME DE L'ECOLE DES PRATICIENS DU COMMERCE INTERNATIONAL DE CERGY;RNCP24575;Niveau 6;DIPLOVIS;v1.0;oui;31/08/2017;INACTIVE
32023013;MANAGEMENT ECONOMIQUE DE LA CONSTRUCTION  (BTS);RNCP35802;Niveau 5;BTS;v2.1;oui;31/08/2026;ACTIVE
16X33401;MANAGER DES HEBERGEMENTS TOURISTIQUES (ESGCV - MBA ESG);RNCP34056;Niveau 7;;v1.7;oui;05/07/2024;ACTIVE
25011817;BIO-INDUSTRIES ET BIOTECHNOLOGIES (LP BREST);RNCP30047;Niveau 6;Licence Professionnelle;v1.0;oui;01/01/2025;ACTIVE
50023120;CONSTRUCTEUR DE ROUTES ET D'AMENAGEMENTS URBAINS (CAP);RNCP35888;Niveau 3;CAP;v2.1;oui;31/08/2026;ACTIVE
44633509;SPECIALITE SPORT AUTOMOBILE (BP JEPS);RNCP35902;Niveau 4;BPJEPS;v2.1;oui;01/10/2026;ACTIVE
16X11001;MANAGER DE BIOBANQUES (UCLY);RNCP36226;Niveau 7;;CI-09112023;oui;25/02/2027;ACTIVE
1353101B;MANAGEMENT PUBLIC (MASTER);RNCP35914;Niveau 7;MASTER;v2.1;oui;31/08/2026;ACTIVE
32032611;SERVICES INFORMATIQUES AUX ORGANISATIONS OPTION B SOLUTIONS LOGICIELLES ET APPLICATIONS METIERS (BTS);RNCP35340;Niveau 5;BTS;v2.1;oui;31/08/2025;ACTIVE
24622701;RESPONSABLE CONCEPTION EN INSTALLATIONS FRIGORIFIQUES ET CLIMATIQUES (CNAM);RNCP35152;Niveau 6;;v1.0;oui;16/12/2025;ACTIVE
16X31322;EXPERT EN GESTION D'ACTIFS MOBILIERS ET IMMOBILIERS (MS KEDGE BUSINESS SCHOOL);RNCP36211;Niveau 7;;v2.4;oui;24/02/2027;ACTIVE
25020062;METIERS DU DESIGN (LP CHAMBERY);RNCP30148;Niveau 6;Licence Professionnelle;v1.0;oui;01/01/2025;ACTIVE
25011804;BIO-INDUSTRIES ET BIOTECHNOLOGIES (LP LYON 1);RNCP30047;Niveau 6;Licence Professionnelle;v1.0;oui;01/01/2025;ACTIVE
26520102;TRANSFORMATION NUMERIQUE DES ENTREPRISES (BACHELOR EN SCIENCES ET INGENIERIE ISEP);RNCP37572;Niveau 6;Grade_Licence;CI-09112023;oui;31/08/2026;ACTIVE
13520011;GENIE INDUSTRIEL (MASTER AMIENS);RNCP34113;Niveau 7;MASTER;v1.0;oui;31/08/2024;ACTIVE
32025520;ELECTROTECHNIQUE (BTS);RNCP35346;Niveau 5;BTS;v1.6;oui;31/08/2025;ACTIVE
40031209;POISSONNIER-ECAILLER-TRAITEUR (BAC PRO);RNCP37927;Niveau 4;BAC PRO;CI-09112023;oui;31/08/2028;ACTIVE
25131001;GESTION ADMINISTRATIVE ET COMMERCIALE DES ORGANISATIONS : MANAGEMENT DES ACTIVITES CULTURELLES, ARTISTIQUES, SPORTIVES ET DE TOURISME (BUT);RNCP35389;Niveau 6;BUT;v1.7;oui;31/08/2026;ACTIVE
40022106;CUISINE (BAC PRO);RNCP37910;Niveau 4;BAC PRO;CI-09112023;oui;31/08/2028;ACTIVE
25131103;QUALITE, LOGISTIQUE INDUSTRIELLE ET ORGANISATION : PILOTAGE DE LA CHAINE LOGISTIQUE GLOBALE (BUT);RNCP35351;Niveau 6;BUT;v1.7;oui;31/08/2026;ACTIVE
25031053;METIERS DE L'ENTREPRENEURIAT (LP LORRAINE);RNCP30122;Niveau 6;Licence Professionnelle;v1.0;oui;01/01/2025;ACTIVE
45022002;TECHNIQUES DE LABORATOIRE DE RECHERCHE OPTION A BIOLOGIE (BP);RNCP1172;Niveau 4;BP;v1.0;oui;01/01/2025;ACTIVE
20533509;SCIENCES ET TECHNIQUES DES ACTIVITES PHYSIQUES ET SPORTIVES : ACTIVITE PHYSIQUE ADAPTEE ET SANTE (LIC LMD);RNCP35944;Niveau 6;LICENCE;v2.1;oui;31/08/2026;ACTIVE
36X31211;CHEF DE PROJET MARKETING ET COMMERCE DES VINS ET SPIRITUEUX (INSTITUT SUPERIEUR DU VIN);RNCP37168;Niveau 6;;v2.9;oui;14/12/2024;ACTIVE
20512604;HISTOIRE (LIC LMD);RNCP24430;Niveau 6;LICENCE;v1.0;oui;01/01/2025;ACTIVE
13512893;DROIT PUBLIC (MASTER PARIS SACLAY);RNCP34084;Niveau 7;MASTER;v1.0;oui;31/08/2024;ACTIVE
25022728;METIERS DE L'ENERGETIQUE, DE L'ENVIRONNEMENT ET DU GENIE CLIMATIQUE (LP LORRAINE);RNCP30121;Niveau 6;Licence Professionnelle;v1.0;oui;01/01/2025;ACTIVE
26X33404;RESPONSABLE DU DEVELOPPEMENT COMMERCIAL DE PRODUITS TOURISTIQUES (IPAC);RNCP35979;Niveau 6;;v2.4;oui;15/10/2022;INACTIVE
36X32613;DEVELOPPEUR INFORMATIQUE (CESI);RNCP34253;Niveau 5;;v1.3;oui;10/10/2024;ACTIVE
13532107;JOURNALISME (MASTER STRASBOURG);RNCP34036;Niveau 7;MASTER;v1.1;oui;31/08/2024;ACTIVE
20512209;ECONOMIE ET GESTION (LIC LMD AMIENS);RNCP24426;Niveau 6;LICENCE;v1.0;oui;01/01/2025;ACTIVE
16X32605;MANAGER ENTREPRENEURIAL DE PROJET NUMERIQUE ET STRATEGIE DIGITALE (CAMPUS FONDERIE DE L'IMAGE);RNCP34267;Niveau 7;;v1.2;oui;10/10/2024;ACTIVE
26R33001;MANAGER DE PROXIMITE DANS L'ECONOMIE SOCIALE ET SOLIDAIRE (IRUP);RNCP37425;Niveau 6;;v1.0;oui;27/03/2026;ACTIVE
25022744;METIERS DE L'ENERGETIQUE, DE L'ENVIRONNEMENT ET DU GENIE CLIMATIQUE (LP AIX MARSEILLE);RNCP30121;Niveau 6;Licence Professionnelle;v1.0;oui;01/01/2025;ACTIVE
56033204;ACCOMPAGNANT EDUCATIF ET SOCIAL SPECIALITE ACCOMPAGNEMENT DE LA VIE A DOMICILE (DIPLOME D'ETAT);RNCP36004;Niveau 3;DE;v2.2;oui;01/09/2026;ACTIVE
13511107;SCIENCES ET GENIE DES MATERIAUX (MASTER PARIS SACLAY);RNCP32137;Niveau 7;MASTER;v1.0;oui;01/01/2025;ACTIVE
35520001;PRODUCTION INDUSTRIELLE SPE ARTS ET TECHNIQUES APPLIQUES (DEUST CNAM);RNCP23013;Niveau 5;DEUST;v2.3;oui;01/01/2025;ACTIVE
46T33406;ANIMATEUR LOISIR TOURISME (TP);RNCP32350;Niveau 4;TP;v1.0;oui;29/05/2024;ACTIVE
36T32401;ASSISTANTE DE DIRECTION (TP);RNCP34143;Niveau 5;TP;v1.0;oui;29/07/2024;ACTIVE
16X31067;MANAGER DES RISQUES (MS ENSAM);RNCP35211;Niveau 7;;CI-09112023;oui;20/01/2024;ACTIVE
46E31001;ENTREPRENEUR TPE (UNIVERSITES PARIS EST CRETEIL, PARIS EST MARNE LA VALLEE, BRETAGNE SUD, PARIS 13, LA REUNION);RNCP28089;Niveau 4;;v1.0;oui;23/08/2020;INACTIVE
26X32048;RESPONSABLE DE LA CREATION (E-ARTSUP);RNCP37139;Niveau 6;;v2.9;oui;14/12/2024;ACTIVE
13532677;INFORMATIQUE (MASTER LYON 1);RNCP34126;Niveau 7;MASTER;v1.0;oui;31/08/2024;ACTIVE
25032209;METIERS DU LIVRE : EDITION ET COMMERCE DU LIVRE (LP MARNE LA VALLEE);RNCP30151;Niveau 6;Licence Professionnelle;v1.0;oui;01/01/2025;ACTIVE
1353101W;MANAGEMENT SECTORIEL (MASTER PAU);RNCP35911;Niveau 7;MASTER;v2.1;oui;31/08/2026;ACTIVE
20511601;CHIMIE (LIC LMD);RNCP24528;Niveau 6;LICENCE;v1.9;oui;01/01/2025;ACTIVE
25021021;AGRONOMIE (LP);RNCP30043;Niveau 6;Licence Professionnelle;v1.0;oui;01/01/2025;ACTIVE
2503120U;GESTION DES ACHATS ET DES APPROVISIONNEMENTS (LP BORDEAUX);RNCP30065;Niveau 6;Licence Professionnelle;v1.0;oui;01/01/2025;ACTIVE
46125501;TECHNICIEN(NE) EN RESEAUX ELECTRIQUES (CS4);RNCP37235;Niveau 4;MC4;CI-30112023;oui;31/08/2027;ACTIVE
36N2000A;CHARGE DE GESTION TECHNIQUE DES BATIMENTS TERTIAIRES ET INDUSTRIELS (IRUP);RNCP36408;Niveau 5;;v1.0;oui;25/04/2025;ACTIVE
56T22505;MENUISIER(ERE) EN CONSTRUCTION NAUTIQUE (LP);RNCP34285;Niveau 3;TP;v1.1;oui;09/10/2024;ACTIVE
16X31221;MANAGER PRODUITS ET MARKETING (ESGCV);RNCP35960;Niveau 7;;v2.1;oui;15/10/2026;ACTIVE
44633504;SPECIALITE TECHNIQUES DE L'INFORMATION ET DE LA COMMUNICATION (BP JEPS);RNCP1974;Niveau 4;BPJEPS;v1.0;oui;04/01/2023;INACTIVE
36X32406;SECRETAIRE JURIDIQUE (ADDSA);RNCP37418;Niveau 5;;v1.5;oui;27/03/2026;ACTIVE
26X32401;STENOTYPISTE DE CONFERENCES (EDTA SORNAS);RNCP35218;Niveau 6;;v2.0;oui;20/01/2023;INACTIVE
46T23403;MENUISIER AGENCEUR (TP);RNCP36256;Niveau 3;TP;v2.4;oui;21/10/2027;ACTIVE
40033606;ESTHETIQUE COSMETIQUE PARFUMERIE (BAC PRO);RNCP36331;Niveau 4;BAC PRO;v2.5;oui;31/08/2027;ACTIVE
40022308;ARTISANAT ET METIERS D'ART - FACTEUR D'ORGUES OPTION ORGANIER (BAC PRO);RNCP35320;Niveau 4;BAC PRO;v2.3;oui;31/08/2025;ACTIVE
13531511;GESTION DES RESSOURCES HUMAINES (MASTER CAEN);RNCP35912;Niveau 7;MASTER;v2.1;oui;31/08/2026;ACTIVE
25032041;METIERS DU NUMERIQUE : CONCEPTION, REDACTION ET REALISATION WEB (LP CLERMONT AUVERGNE);RNCP29971;Niveau 6;Licence Professionnelle;v1.0;oui;01/01/2025;ACTIVE
40025409;TECHNICIEN EN CHAUDRONNERIE INDUSTRIELLE (BAC PRO);RNCP29885;Niveau 4;BAC PRO;v1.0;oui;01/01/2025;ACTIVE
17022002;INGENIEUR DIPLOME DE L'ECOLE EUROPEENNE D'INGENIEUR EN GENIE DES MATERIAUX DE L'UNIVERSITE DE LORRAINE;RNCP17505;Niveau 7;Titre ingénieur;v1.0;oui;01/01/2025;ACTIVE
20532611;INFORMATIQUE (LIC LMD MARNE LA VALLEE);RNCP24514;Niveau 6;LICENCE;v1.0;oui;01/01/2025;ACTIVE
13531324;MANAGEMENT ET ADMINISTRATION DES ENTREPRISES (MASTER BESANCON);RNCP35916;Niveau 7;MASTER;v2.4;oui;31/08/2026;ACTIVE
26X23001;CHARGE D'AFFAIRES BTP (CESI);RNCP38141;Niveau 6;;CI-27112023;oui;18/10/2028;ACTIVE
20513618;LANGUES, LITTERATURES ET CIVILISATIONS ETRANGERES ET REGIONALES (LIC LMD BORDEAUX 3);RNCP24508;Niveau 6;LICENCE;v1.0;oui;01/01/2025;ACTIVE
13512407;PSYCHOLOGIE SOCIALE, DU TRAVAIL ET DES ORGANISATIONS (MASTER);RNCP31811;Niveau 7;MASTER;v1.0;oui;01/01/2025;ACTIVE
50022351;BRONZIER OPTION C : TOURNEUR SUR BRONZE (CAP);RNCP532;Niveau 3;CAP;v1.0;oui;01/01/2025;ACTIVE
46T33401;ANIMATEUR DE TOURISME LOCAL (TP);RNCP282;Niveau 4;TP;v1.0;non;;INACTIVE
17032613;INGENIEUR DIPLOME DE L'INSTITUT NATIONAL DES SCIENCES APPLIQUEES DE LYON, SPECIALITE INFORMATIQUE;RNCP35971;Niveau 7;Titre ingénieur;v2.1;oui;31/08/2025;ACTIVE
1702400A;INGENIEUR DIPLOME DE L'INSTITUT TEXTILE ET CHIMIQUE DE LYON;RNCP36971;Niveau 7;Titre ingénieur;v2.8;oui;31/08/2025;ACTIVE
26X32650;CONCEPTEUR DEVELOPPEUR FULL STACK (IFOCOP);RNCP36926;Niveau 6;;CI-09112023;oui;29/09/2024;ACTIVE
25034331;METIERS DE LA PROTECTION ET DE LA GESTION DE L'ENVIRONNEMENT (LP MARNE LA VALLEE);RNCP30087;Niveau 6;Licence Professionnelle;v1.0;oui;01/01/2025;ACTIVE
40025411;TECHNICIEN EN CHAUDRONNERIE INDUSTRIELLE (BAC PRO);RNCP38337;Niveau 4;BAC PRO;CI-01122023;oui;31/08/2028;ACTIVE
20511801;SCIENCES DE LA VIE (LIC LMD BORDEAUX);RNCP24530;Niveau 6;LICENCE;v1.0;oui;01/01/2025;ACTIVE
2503260H;METIERS DES RESEAUX INFORMATIQUES ET TELECOMMUNICATIONS (LP LA ROCHELLE);RNCP29968;Niveau 6;Licence Professionnelle;v1.0;oui;01/01/2025;ACTIVE
20512501;SCIENCES DU LANGAGE (LIC LMD);RNCP24467;Niveau 6;LICENCE;v1.0;oui;01/01/2025;ACTIVE
32024206;DESIGN DE MODE, TEXTILE ET ENVIRONNEMENT OPTION A : MODE;RNCP823;Niveau 5;BTS;v1.0;oui;31/08/2021;INACTIVE
36T23105;TECHNICIEN EN DETECTION ET GEOREFERENCEMENT DE RESEAUX (TP);RNCP37102;Niveau 5;TP;v3.0;oui;02/01/2028;ACTIVE
1353261D;METHODES INFORMATIQUES APPLIQUEES A LA GESTION DES ENTREPRISES - MIAGE (MASTER ANTILLES);RNCP31471;Niveau 7;MASTER;v1.0;oui;01/01/2025;ACTIVE
17032615;INGENIEUR DIPLOME DE L'ECOLE SUPERIEURE ANGEVINE D'INFORMATIQUE ET DE PRODUCTIQUE, SPECIALITE INFORMATIQUE ET RESEAUX;RNCP35568;Niveau 7;Titre ingénieur;v1.7;oui;31/08/2026;ACTIVE
56T23204;COFFREUR BANCHEUR (TP);RNCP35312;Niveau 3;TP;v1.6;oui;04/03/2026;ACTIVE
26C22101;CHEF DE PROJET COMMERCIAL POUR L'AGROALIMENTAIRE (ISEMA );RNCP4050;Niveau 6;;v1.0;oui;07/08/2021;INACTIVE
32022207;BIOANALYSES ET CONTROLE (BTS);RNCP2705;Niveau 5;BTS;v1.0;oui;01/01/2025;ACTIVE
25032021;METIERS DE LA COMMUNICATION : CHARGE DE COMMUNICATION (LP CERGY);RNCP30101;Niveau 6;Licence Professionnelle;v1.0;oui;01/01/2025;ACTIVE
26X32037;RESPONSABLE DE PROJET WEB ET MOBILE (SUP INTERNET);RNCP32192;Niveau 6;;v1.2;oui;04/01/2022;INACTIVE
26X32613;RESPONSABLE EN STRATEGIE DIGITALE ET GESTION DE PROJET (EFREI PARIS);RNCP29818;Niveau 6;;v1.0;oui;08/02/2021;INACTIVE
40025410;CONSTRUCTION DES CARROSSERIES (BAC PRO);RNCP14963;Niveau 4;BAC PRO;v1.0;oui;01/01/2025;ACTIVE
16X32025;CONCEPTEUR REALISATEUR EN FILM D'ANIMATION 3D VFX (NEW 3D GENERAL EDUCATION);RNCP30729;Niveau 7;;v1.3;non;24/05/2021;INACTIVE
26X32611;CHEF DE PROJET DIGITAL (IEF21);RNCP36011;Niveau 6;;v2.2;oui;10/11/2023;INACTIVE
50034002;AGENT DE PREVENTION ET DE MEDIATION (CAP);RNCP37240;Niveau 3;CAP;v2.9;oui;31/08/2027;ACTIVE
26532001;BACHELOR EN SCIENCES ET INGENIERIE - COMMUNICATION GLOBALE ET DESIGN DIGITAL;RNCP37124;Niveau 6;Grade_Licence;v3.0;oui;31/08/2025;ACTIVE
1702550J;INGENIEUR DIPLOME DE L'ECOLE NATIONALE SUPERIEURE DE L'ELECTRONIQUE ET DE SES APPLICATIONS, SPECIALITE ELECTRONIQUE ET INFORMATIQUE INDUSTRIELLE;RNCP31485;Niveau 7;Titre ingénieur;v1.2;oui;01/01/2025;ACTIVE
36322108;TECHNICIEN CONSEIL DANS LES ENTREPRISES D'AMONT DE LA FILIERE VIANDE (CSA);RNCP2297;Niveau 5;CS;v1.0;oui;23/06/2020;INACTIVE
13520021;DESIGN (MASTER BORDEAUX 3);RNCP34439;Niveau 7;MASTER;v1.0;oui;31/08/2024;ACTIVE
44633506;SPECIALITE ACTIVITES PHYSIQUES POUR TOUS (BP JEPS);RNCP28573;Niveau 4;BPJEPS;v1.7;oui;01/01/2025;ACTIVE
25031510;METIERS DE LA GRH : ASSISTANT (LP MULHOUSE);RNCP29806;Niveau 6;Licence Professionnelle;v1.0;oui;01/01/2025;ACTIVE
25022128;INDUSTRIES AGROALIMENTAIRES : GESTION, PRODUCTION ET VALORISATION (LP CAEN);RNCP30074;Niveau 6;Licence Professionnelle;v1.0;oui;01/01/2025;ACTIVE
26531202;DIPLOME DE GESTION ET MANAGEMENT DES ENTREPRISES (GBM) DE SCBS TROYES;RNCP36008;Niveau 6;DipViGrL;v2.5;oui;31/08/2025;ACTIVE
25032682;METIERS DES RESEAUX INFORMATIQUES ET TELECOMMUNICATIONS (LP LIMOGES);RNCP29968;Niveau 6;Licence Professionnelle;v1.0;oui;01/01/2025;ACTIVE
13512216;ECONOMIE DE L'ENVIRONNEMENT, DE L'ENERGIE ET DES TRANSPORTS (MASTER);RNCP34221;Niveau 7;MASTER;v1.0;oui;31/08/2024;ACTIVE
25031408;METIERS DE LA GESTION ET DE LA COMPTABILITE : COMPTABILITE ET PAIE (LP CNAM);RNCP30106;Niveau 6;Licence Professionnelle;v1.0;oui;01/01/2025;ACTIVE
25021022;GESTION DES ORGANISATIONS AGRICOLES ET AGROALIMENTAIRES (LP);RNCP29762;Niveau 6;Licence Professionnelle;v1.0;oui;01/01/2025;ACTIVE
36C3150B;ASSISTANT(E) EN RESSOURCES HUMAINES (CCI FRANCE - RESEAU ESMASS);RNCP36612;Niveau 5;;v2.7;oui;01/07/2027;ACTIVE
25013601;GUIDE CONFERENCIER (LP MARNE LA VALLEE);RNCP29977;Niveau 6;Licence Professionnelle;v1.0;oui;01/01/2025;ACTIVE
13531445;CONTROLE DE GESTION ET AUDIT ORGANISATIONNEL (MASTER);RNCP35918;Niveau 7;MASTER;v2.1;oui;31/08/2026;ACTIVE
20532002;INFORMATION-COMMUNICATION (LIC LMD);RNCP38189;Niveau 6;LICENCE;CI-27112023;oui;31/12/2028;ACTIVE
13531509;GESTION DES RESSOURCES HUMAINES (MASTER MONTPELLIER 3);RNCP35912;Niveau 7;MASTER;v2.1;oui;31/08/2026;ACTIVE
50321405;JARDINIER PAYSAGISTE (CAPA);RNCP24928;Niveau 3;CAPA;v1.0;oui;01/01/2025;ACTIVE
