32031213;MANAGEMENT COMMERCIAL OPERATIONNEL (BTS);RNCP38362;Niveau 5;BTS;CI-13122023;oui;31/12/2028;ACTIVE
25020096;METIERS DE L'INDUSTRIE : MECATRONIQUE, ROBOTIQUE (LP NANTES);RNCP30131;Niveau 6;Licence Professionnelle;v1.0;oui;01/01/2025;ACTIVE
25022741;METIERS DE L'ENERGETIQUE, DE L'ENVIRONNEMENT ET DU GENIE CLIMATIQUE (LP PARIS 12);RNCP30121;Niveau 6;Licence Professionnelle;v1.0;oui;01/01/2025;ACTIVE
45033408;SOMMELIER (BP);RNCP37384;Niveau 4;BP;CI-07122023;oui;01/09/2028;ACTIVE
26031029;DIPLOME D'ETUDES SUPERIEURES EN MANAGEMENT DE L'ISC PARIS;RNCP36755;Niveau 6;DipViGrL;v2.7;oui;31/08/2025;ACTIVE
16033101;MASSEUR-KINESITHERAPEUTE (DIPLOME D'ETAT);RNCP28353;Niveau 7;DE;v1.9;oui;01/01/2025;ACTIVE
46T22706;TECHNICIEN D'INSTALLATION EN EQUIPEMENTS DE CONFORT CLIMATIQUE (TP);RNCP35231;Niveau 4;TP;v1.6;oui;03/03/2026;ACTIVE
13512224;INTELLIGENCE ECONOMIQUE (MASTER MARNE LA VALLEE);RNCP34077;Niveau 7;MASTER;v1.0;oui;31/08/2024;ACTIVE
56X31201;CONSEILLER COMMERCIAL ET GESTIONNAIRE DES LIEUX (RATP);RNCP31889;Niveau 3;;v1.0;oui;18/12/2023;ACTIVE
16531230;DIPLOME DE L'EUROPEAN BUSINESS SCHOOL DE PARIS - PGE;RNCP35177;Niveau 7;DipViGrM;v1.6;oui;31/08/2024;ACTIVE
1353103D;MANAGEMENT SECTORIEL (MASTER LIMOGES);RNCP35911;Niveau 7;MASTER;v2.1;oui;31/08/2026;ACTIVE
13531537;GESTION DES RESSOURCES HUMAINES (MASTER ANGERS);RNCP35912;Niveau 7;MASTER;v2.1;oui;31/08/2026;ACTIVE
56T34301;AGENT DE PROPRETE ET D'HYGIENE (TP);RNCP37872;Niveau 3;TP;CI-09112023;oui;13/08/2028;ACTIVE
26X32211;GRAPHISTE MOTION DESIGNER (ITECOM);RNCP38143;Niveau 6;;CI-09112023;oui;18/10/2026;ACTIVE
36321007;RESPONSABLE TECHNICO COMMERCIAL EN AGROFOURNITURES (CSA);RNCP2285;Niveau 5;CS;v1.0;oui;01/01/2025;ACTIVE
36322110;RESPONSABLE DE FROMAGERIE EN FABRICATION TRADITIONNELLE (CSA);RNCP2282;Niveau 5;CS;v1.0;oui;23/06/2020;INACTIVE
26X32628;DEVELOPPEUR D'APPLICATION FULL STACK (IT AKADEMY);RNCP36400;Niveau 6;;v1.3;oui;25/04/2024;ACTIVE
40030001;GESTION-ADMINISTRATION (BAC PRO);RNCP34606;Niveau 4;BAC PRO;v1.3;oui;31/08/2025;ACTIVE
36U33501;GESTIONNAIRE DES ORGANISATIONS SPORTIVES (DU LYON 1);RNCP38271;Niveau 5;;CI-27112023;oui;15/11/2025;ACTIVE
36T23201;CHEF DE CHANTIER GROS OEUVRE (TP);RNCP1863;Niveau 5;TP;v1.0;oui;20/04/2024;ACTIVE
46X32412;SECRETAIRE MEDICAL (ADIEL-ACF-ALTERNANCE-CONSEIL-FORMATION);RNCP36219;Niveau 4;;v2.7;oui;25/02/2024;ACTIVE
25025547;MAITRISE DE L'ENERGIE, ELECTRICITE, DEVELOPPEMENT DURABLE (LP NANTES);RNCP30094;Niveau 6;Licence Professionnelle;v1.0;oui;01/01/2025;ACTIVE
16X32021;MANAGER DE L'INNOVATION NUMERIQUE (WEB SCHOOL FACTORY);RNCP34509;Niveau 7;;v1.2;oui;30/03/2025;ACTIVE
16X32649;DELEGUE A LA PROTECTION DES DONNEES (DPO) (DORANCO ESPACE MULTIMEDIA);RNCP35086;Niveau 7;;v1.4;oui;18/11/2023;INACTIVE
40124106;ARTS ET TECHNIQUES DU TAPIS ET DE LA TAPISSERIE DE LISSE (BMA);RNCP4003;Niveau 4;BMA;v1.0;oui;01/01/2025;ACTIVE
16X32008;MANAGER DE LA COMMUNICATION DIGITALE ET DATA SCIENCE (ECOLE SUPERIEURE DE COMMUNICATION PUBLICITE ET MARKETING);RNCP31914;Niveau 7;;v1.0;oui;18/12/2023;ACTIVE
2502001B;METIERS DE L'INDUSTRIE : GESTION DE LA PRODUCTION INDUSTRIELLE (LP BRETAGNE SUD);RNCP30128;Niveau 6;Licence Professionnelle;v1.0;oui;01/01/2025;ACTIVE
1353102C;MANAGEMENT (MASTER SAINT ETIENNE);RNCP35917;Niveau 7;MASTER;v2.1;oui;31/08/2026;ACTIVE
25121001;GENIE BIOLOGIQUE : AGRONOMIE (BUT);RNCP35369;Niveau 6;BUT;v1.7;oui;31/08/2026;ACTIVE
13512898;DROIT PUBLIC (MASTER DIJON);RNCP34084;Niveau 7;MASTER;v1.0;oui;31/08/2024;ACTIVE
16X31026;MANAGER EN STRATEGIE DE DEVELOPPEMENT DES ORGANISATIONS (IRUP);RNCP36379;Niveau 7;;v1.2;oui;25/04/2025;ACTIVE
26X32325;ASSISTANT REALISATEUR (EICAR);RNCP36874;Niveau 6;;v2.8;oui;29/09/2024;ACTIVE
26X32009;CHARGE DE LA COMMUNICATION (CCI DU CHER - ESTACOM);RNCP13889;Niveau 6;;v1.0;oui;21/12/2022;INACTIVE
25132606;METIERS DU MULTIMEDIA ET DE L'INTERNET : CREATION NUMERIQUE (BUT);RNCP35501;Niveau 6;BUT;v1.7;oui;31/08/2026;ACTIVE
2502001J;MAINTENANCE ET TECHNOLOGIE : ORGANISATION DE LA MAINTENANCE (LP RENNES 1);RNCP30091;Niveau 6;Licence Professionnelle;v1.0;oui;01/01/2025;ACTIVE
13513403;INDUSTRIES CULTURELLES (MASTER);RNCP36768;Niveau 7;MASTER;v1.0;oui;15/07/2027;ACTIVE
13531401;CONTROLE DE GESTION ET AUDIT ORGANISATIONNEL (MASTER GRENOBLE ALPES);RNCP35918;Niveau 7;MASTER;v2.1;oui;31/08/2026;ACTIVE
36T20103;TECHNICIEN(NE) SUPERIEUR(E) EN GESTION INDUSTRIELLE (TP);RNCP36240;Niveau 5;TP;v2.4;oui;24/03/2025;ACTIVE
25022753;MAITRISE DE L'ENERGIE, ELECTRICITE, DEVELOPPEMENT DURABLE (LP TOULOUSE 3);RNCP30094;Niveau 6;Licence Professionnelle;v1.0;oui;01/01/2025;ACTIVE
50025441;PEINTRE AUTOMOBILE (CAP);RNCP37540;Niveau 3;CAP;CI-07122023;oui;31/08/2028;ACTIVE
26X24210;STYLISTE MODELISTE COCEPTEUR DE MODE (SUPDEMODE);RNCP37081;Niveau 6;;v2.9;oui;23/11/2024;ACTIVE
25032698;METIERS DE L'INFORMATIQUE : SYSTEMES D'INFORMATION ET GESTION DES DONNEES (LP GRENOBLE ALPES);RNCP29973;Niveau 6;Licence Professionnelle;v1.0;oui;01/01/2025;ACTIVE
26C25501;RESPONSABLE DE TRAVAUX RESEAUX TELECOMS TRES HAUT DEBIT (CCI FRANCE RSX FORMATIONS TRES HT DEBIT);RNCP36933;Niveau 5;;v2.8;oui;29/09/2025;ACTIVE
13512890;DROIT, ECONOMIE, GESTION : DROIT DES AFFAIRES (MASTER VALENCIENNES);RNCP34127;Niveau 7;MASTER;v1.0;oui;31/08/2024;ACTIVE
26X31504;RESPONSABLE DE GESTION DES RESSOURCES HUMAINES (IPAC);RNCP34654;Niveau 6;;v1.0;oui;29/05/2025;ACTIVE
46X32309;TECHNICIEN SON (STAFF);RNCP36600;Niveau 4;;v2.7;oui;01/07/2024;ACTIVE
25020091;METIERS DE L'INDUSTRIE : CONCEPTION DE PRODUITS INDUSTRIELS (LP BESANCON);RNCP30125;Niveau 6;Licence Professionnelle;v1.0;oui;01/01/2025;ACTIVE
23633502;DIPLOME D'ETAT SUPERIEUR DE LA JEUNESSE, DE L'EDUCATION POPULAIRE ET DU SPORT SPE PERFORMANCE SPORTIVE (DES JEPS);RNCP4911;Niveau 6;DESJEPS;v2.4;oui;01/01/2025;ACTIVE
1703260H;INGENIEUR DIPLOME DE L'ECOLE SUPERIEURE DE CHIMIE, PHYSIQUE, ELECTRONIQUE DE LYON, SPECIALITE INFORMATIQUE ET RESEAUX;RNCP4619;Niveau 7;Titre ingénieur;v1.0;oui;01/01/2025;ACTIVE
01034201;ENTRETIEN DES COLLECTIONS DU PATRIMOINE (MC NIVEAU V);RNCP37314;Niveau 3;MC5;v2.9;oui;31/08/2028;ACTIVE
56T33403;EMPLOYE D'ETAGE EN HOTELLERIE (TP);RNCP32342;Niveau 3;TP;v1.0;oui;25/05/2024;ACTIVE
26C3120J;RESPONSABLE DE DEVELOPPEMENT COMMERCIAL (CCI FRANCE);RNCP36395;Niveau 6;;v1.0;oui;25/04/2025;ACTIVE
25031024;QUALITE, HYGIENE, SECURITE, SANTE, ENVIRONNEMENT (LP CAEN);RNCP30098;Niveau 6;Licence Professionnelle;v1.0;oui;01/01/2025;ACTIVE
13531534;GESTION DES RESSOURCES HUMAINES (MASTER BESANCON);RNCP35912;Niveau 7;MASTER;v2.1;oui;31/08/2026;ACTIVE
26522701;EFFICACITE ENERGETIQUE (BACHELOR EN SCIENCES ET INGENIERIE EPF);RNCP36316;Niveau 6;Grade_Licence;v2.5;oui;31/08/2024;ACTIVE
26031211;RESPONSABLE DU MARKETING ET DU DEVELOPPEMENT COMMERCIAL (IDRAC);RNCP35025;Niveau 6;DIPLOVIS;v1.3;oui;31/08/2025;ACTIVE
40321302;GESTION DES MILIEUX NATURELS ET DE LA FAUNE (BAC PRO AG);RNCP36789;Niveau 4;BAC PRO;v2.7;oui;31/08/2027;ACTIVE
16531216;PROGRAMME GRANDE ECOLE DE L'ECOLE SUPERIEURE DE COMMERCE DE BREST;RNCP36764;Niveau 7;DipViGrM;v2.7;oui;31/08/2026;ACTIVE
46X33003;PRATICIEN ANIMATEUR DE SPA (GROUPE SILVYA TERRADE);RNCP34777;Niveau 4;;v1.3;oui;23/07/2025;ACTIVE
25023022;METIERS DE L'IMMOBILIER : TRANSACTION ET COMMERCIALISATION DE BIENS IMMOBILIERS (LP VERSAILLES);RNCP30124;Niveau 6;Licence Professionnelle;v1.0;oui;01/01/2025;ACTIVE
13511801;BIO-INFORMATIQUE (MASTER);RNCP34129;Niveau 7;MASTER;v1.0;oui;31/08/2024;ACTIVE
20533501;SCIENCES ET TECHNIQUES DES ACTIVITES PHYSIQUES ET SPORTIVES (LIC LMD DIJON);RNCP35944;Niveau 6;LICENCE;v2.1;oui;31/08/2026;ACTIVE
17032629;INGENIEUR DIPLOME DU CONSERVATOIRE NATIONAL DES ARTS ET METIERS SPECIALITE INFORMATIQUE ET SYSTEMES D'INFORMATION;RNCP37358;Niveau 7;Titre ingénieur;CI-09112023;oui;31/08/2024;ACTIVE
26X24204;STYLISTE DESIGNER (MODE'ESTAH);RNCP35872;Niveau 6;;v2.1;oui;15/09/2024;ACTIVE
26N32601;ADMINISTRATEUR SYSTEMES, RESEAUX ET BASES DE DONNEES (ADIP - IPI);RNCP35594;Niveau 6;;v1.8;oui;19/05/2026;ACTIVE
25022274;INDUSTRIES PHARMACEUTIQUES, COSMETOLOGIQUES ET DE SANTE : GESTION, PRODUCTION ET VALORISATION (LP BORDEAUX);RNCP30075;Niveau 6;Licence Professionnelle;v1.0;oui;01/01/2025;ACTIVE
46321005;CONDUITE DE PRODUCTION EN AGRICULTURE BIOLOGIQUE ET COMMERCIALISATION (CSA);RNCP2271;Niveau 4;CS;v1.0;oui;01/01/2025;ACTIVE
36X21001;CONDUCTEUR DE TRAVAUX EN ENTREPRISES DE TRAVAUX AGRICOLES (FEDERATION NATIONALE ENTREPRENEURS DES TERRITOIRES);RNCP37839;Niveau 5;;CI-16122023;oui;19/07/2025;ACTIVE
25025551;DOMOTIQUE (LP PARIS12);RNCP29796;Niveau 6;Licence Professionnelle;v1.0;oui;01/01/2025;ACTIVE
25022153;INDUSTRIES AGROALIMENTAIRES : GESTION, PRODUCTION ET VALORISATION (LP LYON 1);RNCP30074;Niveau 6;Licence Professionnelle;v1.0;oui;01/01/2025;ACTIVE
26X31238;RESPONSABLE DE LA STRATEGIE MARKETING ET DU DEVELOPPEMENT COMMERCIAL OMNICANAL (IFOCOP);RNCP36727;Niveau 6;;v2.7;oui;20/07/2027;ACTIVE
55321302;TRAVAUX FORESTIERS TRAVAUX DE BUCHERONNAGE (BPA5);RNCP5832;Niveau 3;BPA;v1.0;oui;01/01/2025;ACTIVE
25031533;METIERS DE LA GESTION ET DE LA COMPTABILITE : COMPTABILITE ET PAIE (LP STRASBOURG);RNCP30106;Niveau 6;Licence Professionnelle;v1.0;oui;01/01/2025;ACTIVE
40033603;ESTHETIQUE COSMETIQUE PARFUMERIE (BAC PRO);RNCP36331;Niveau 4;BAC PRO;v1.3;oui;31/08/2027;ACTIVE
25022756;MAITRISE DE L'ENERGIE, ELECTRICITE, DEVELOPPEMENT DURABLE (LP BRETAGNE SUD);RNCP30094;Niveau 6;Licence Professionnelle;v1.0;oui;01/01/2025;ACTIVE
56T31204;EMPLOYE TECHNICIEN-VENDEUR EN MATERIEL DE SPORT (TP);RNCP35992;Niveau 3;TP;v2.3;oui;13/10/2026;ACTIVE
25034312;GENIE DES PROCEDES POUR L'ENVIRONNEMENT (LP TOURS);RNCP30063;Niveau 6;Licence Professionnelle;v1.0;oui;01/01/2025;ACTIVE
26X31017;RESPONSABLE ADMINISTRATIF(VE) BILINGUE - OFFICE MANAGER (CENTRE PARIS EUROPE ALTERNANCE);RNCP37093;Niveau 6;;v2.9;oui;23/11/2025;ACTIVE
26X31257;RESPONSABLE DU DEVELOPPEMENT COMMERCIAL (IPAC);RNCP38123;Niveau 6;;CI-09112023;oui;18/10/2026;ACTIVE
46X22701;INTERVENANT TECHNIQUE EN ENVIRONNEMENT NUCLEAIRE (IRUP);RNCP23645;Niveau 4;;v1.0;oui;24/05/2021;INACTIVE
25022019;METIERS DE L'EMBALLAGE ET DU CONDITIONNEMENT (LP CLERMONT AUVERGNE);RNCP30120;Niveau 6;Licence Professionnelle;v1.0;oui;01/01/2025;ACTIVE
25025559;METIERS DE L'ELECTRONIQUE : FABRICATION DE CARTES ET SOUS-ENSEMBLES ELECTRONIQUES (LP AIX MARSEILLE);RNCP30118;Niveau 6;Licence Professionnelle;v1.0;oui;01/01/2025;ACTIVE
36321208;TECHNICIEN CONSEIL EN PRODUCTION LAITIERE OVINE (CSA);RNCP2300;Niveau 5;CS;v1.0;oui;01/01/2024;ACTIVE
26422101;RESPONSABLE COMMERCIAL POUR L'AGRO-ALIMENTAIRE (RC2A);RNCP34652;Niveau 6;;v1.3;oui;29/05/2023;INACTIVE
32023306;FINITIONS, AMENAGEMENT DES BATIMENTS : CONCEPTION ET REALISATION (BTS);RNCP35809;Niveau 5;BTS;v2.1;oui;31/08/2026;ACTIVE
26X32055;LEAD GAMEPLAY PROGRAMMEUR (ISART DIGITAL);RNCP31021;Niveau 6;;v2.0;oui;21/07/2022;INACTIVE
25032007;METIERS DU NUMERIQUE : CONCEPTION, REDACTION ET REALISATION WEB (LP TOURS);RNCP29971;Niveau 6;Licence Professionnelle;v1.0;oui;01/01/2025;ACTIVE
13531076;DROIT, ECONOMIE, GESTION : GESTION DE PRODUCTION, LOGISTIQUE, ACHATS (MASTER PARIS 12);RNCP35921;Niveau 7;MASTER;v2.1;oui;31/08/2026;ACTIVE
16C20003;MANAGER INDUSTRIE NUMERIQUE EXPERT PLM (CCIT ALLIER);RNCP35260;Niveau 7;;v1.7;oui;10/02/2024;ACTIVE
36T23008;ENCADRANT TECHNIQUE D'UNE OPERATION DE TRAITEMENT DE L'AMIANTE OU D'AUTRES POLLUANTS PARTICULIERS (TP);RNCP38098;Niveau 5;TP;CI-09112023;non;01/01/2029;ACTIVE
25011202;BIO-INDUSTRIES ET BIOTECHNOLOGIES (LP);RNCP30047;Niveau 6;Licence Professionnelle;v1.0;oui;01/01/2025;ACTIVE
46T23404;RESTAURATEUR DE MEUBLES D'ART, ANCIENS ET CONTEMPORAINS (TP);RNCP36244;Niveau 4;TP;v3.0;oui;05/03/2027;ACTIVE
25031271;TECHNICO-COMMERCIAL (LP SAINT ETIENNE);RNCP30163;Niveau 6;Licence Professionnelle;v1.0;oui;01/01/2025;ACTIVE
36X33202;CONSEILLER EMPLOI ET EVOLUTION PROFESSIONNELLE (OPENCLASSROOMS;RNCP36907;Niveau 5;;V2.8;oui;29/09/2024;ACTIVE
16X31524;MANAGER DES RESSOURCES HUMAINES A L'INTERNATIONAL (SUP DES RH);RNCP34981;Niveau 7;;v1.5;oui;14/10/2023;INACTIVE
36X31208;MANAGER DE RAYON (IFOCOP);RNCP34558;Niveau 5;;v1.3;oui;24/04/2025;ACTIVE
16X31507;MANAGER DES RESSOURCES HUMAINES (ECEMA);RNCP37851;Niveau 7;;CI-09112023;oui;19/07/2026;ACTIVE
1702000A;INGENIEUR DIPLOME DU CESI;RNCP37979;Niveau 7;Titre ingénieur;CI-09112023;oui;31/08/2025;ACTIVE
20531024;ADMINISTRATION ECONOMIQUE ET SOCIALE (LIC LMD);RNCP35923;Niveau 6;LICENCE;v2.1;oui;31/08/2026;ACTIVE
46E31401;ASSISTANT DE COMPTABILITE ET D'ADMINISTRATION (CNED UP);RNCP35980;Niveau 4;;v2.1;oui;15/10/2023;INACTIVE
13531439;CONTROLE DE GESTION ET AUDIT ORGANISATIONNEL (MASTER SAINT ETIENNE);RNCP35918;Niveau 7;MASTER;v2.1;oui;31/08/2026;ACTIVE
13511108;CHIMIE PHYSIQUE ET ANALYTIQUE (MASTER);RNCP31488;Niveau 7;MASTER;v1.0;oui;01/01/2025;ACTIVE
25031254;TECHNICO-COMMERCIAL (LP VERSAILLES);RNCP30163;Niveau 6;Licence Professionnelle;v1.0;oui;01/01/2025;ACTIVE
26033102;ERGOTHERAPEUTE (DIPLOME D'ETAT);RNCP18363;Niveau 6;DE;v1.1;oui;01/01/2025;ACTIVE
25022135;INDUSTRIES AGROALIMENTAIRES : GESTION, PRODUCTION ET VALORISATION (LP BREST);RNCP30074;Niveau 6;Licence Professionnelle;v1.0;oui;01/01/2025;ACTIVE
13531386;MONNAIE, BANQUE, FINANCE, ASSURANCE (MASTER POITIERS);RNCP34034;Niveau 7;MASTER;v1.0;oui;31/08/2024;ACTIVE
56X23001;DESSINATEUR PROJETEUR BIM (FCMB);RNCP31947;Niveau 5;;v1.2;oui;21/12/2022;INACTIVE
25122206;GENIE CHIMIQUE - GENIE DES PROCEDES : CONTROLE, PILOTAGE ET OPTIMISATION DES PROCEDES (BUT);RNCP35372;Niveau 6;BUT;v1.7;oui;31/08/2026;ACTIVE
56T22705;MONTEUR-DEPANNEUR EN CLIMATISATION (TP);RNCP37940;Niveau 3;TP;CI-09112023;oui;26/02/2026;ACTIVE
26031023;DIPLOME EN MANAGEMENT GENERAL ET INTERNATIONAL DE PSB;RNCP36785;Niveau 6;DipViGrL;v2.7;oui;31/08/2024;ACTIVE
20512802;DROIT (LIC LMD MONTPELLIER);RNCP24423;Niveau 6;LICENCE;v1.0;oui;01/01/2024;ACTIVE
46X32305;TECHNICIEN(NE) D'EXPLOITATION CINEMATOGRAPHIQUE (AFOMAV);RNCP27759;Niveau 4;;v1.0;oui;03/03/2020;INACTIVE
16X31027;MANAGER DU DEVELOPPEMENT INTERNATIONAL (ASS EDUCATIVE SALLE ST LOUIS STE BARBE);RNCP34516;Niveau 7;;v1.2;oui;30/03/2025;ACTIVE
1353100H;COMPTABILITE - CONTROLE - AUDIT (MASTER VALENCIENNES);RNCP35991;Niveau 7;MASTER;v2.1;oui;31/08/2026;ACTIVE
36X31509;GESTIONNAIRE DE PAIE (STUDI COMPTALIA);RNCP35061;Niveau 5;;v1.4;oui;11/10/2023;INACTIVE
1353100Z;DROIT, ECONOMIE, GESTION : MANAGEMENT STRATEGIQUE (MASTER LILLE 1);RNCP35909;Niveau 7;MASTER;v2.1;oui;31/08/2026;ACTIVE
32032328;METIERS DE L'AUDIOVISUEL OPTION GESTION DE LA PRODUCTION (BTS);RNCP37019;Niveau 5;BTS;v2.8;oui;31/08/2027;ACTIVE
32025007;MAINTENANCE DES SYSTEMES OPTION A SYSTEMES DE PRODUCTION(BTS);RNCP36968;Niveau 5;BTS;v2.8;oui;31/08/2027;ACTIVE
26X31321;RESPONSABLE D'AFFAIRES IMMOBILIERES (SUPTERTIAIRE);RNCP36073;Niveau 6;;v2.3;oui;15/12/2026;ACTIVE
36033205;ASSISTANT DE SERVICE SOCIAL (DIPLOME D'ETAT);RNCP37675;Niveau 6;DE;v1.3;oui;31/08/2026;ACTIVE
26U33301;CONSEILLER(E) EN FORMATION (UNIVERSITE LE HAVRE NORMANDIE);RNCP32062;Niveau 6;;v2.5;oui;04/01/2024;ACTIVE
16531015;DIPLOME EN MANAGEMENT ET GESTION DES ENTREPRISES (ESDES LYON);RNCP36271;Niveau 7;DipViGrM;v2.4;oui;31/08/2025;ACTIVE
56T25202;MECANICIEN(NE) REPARATEUR(TRICE) DE MATERIELS DE CHANTIER ET MANUTENTION (TP);RNCP37545;Niveau 3;TP;v1.3;oui;20/07/2024;ACTIVE
36X31002;AGENT DE GESTION DES PETITES ENTREPRISES (CFP JALLAIS);RNCP34021;Niveau 5;;v1.3;oui;24/05/2024;ACTIVE
1702510R;INGENIEUR DIPLOME DE L'ECOLE NATIONALE SUPERIEURE D'ARTS ET METIERS EN CONVENTION AVEC L'UNIVERSITE DE REIMS, SPECIALITE MECANIQUE;RNCP14468;Niveau 7;Titre ingénieur;v1.0;oui;01/01/2025;ACTIVE
13513622;LANGUES ETRANGERES APPLIQUEES (MASTER CLERMONT AUVERGNE);RNCP34101;Niveau 7;MASTER;v1.0;oui;31/08/2024;ACTIVE
2502000N;METIERS DE L'INDUSTRIE : CONCEPTION ET AMELIORATION DE PROCESSUS ET PROCEDES INDUSTRIELS (LP CLERMONT AUVERGNE));RNCP30126;Niveau 6;Licence Professionnelle;v1.0;oui;01/01/2025;ACTIVE
13532044;AUDIOVISUEL, MEDIAS INTERACTIFS NUMERIQUES, JEUX (MASTER);RNCP31846;Niveau 7;MASTER;v1.0;oui;01/01/2024;ACTIVE
25020143;SYSTEMES AUTOMATISES, RESEAUX ET INFORMATIQUE INDUSTRIELLE (LP CLERMONT AUVERGNE);RNCP29972;Niveau 6;Licence Professionnelle;v1.0;oui;01/01/2025;ACTIVE
25031240;COMMERCIALISATION DE PRODUITS ET SERVICES (LP CERGY);RNCP29631;Niveau 6;Licence Professionnelle;v1.0;oui;01/01/2025;ACTIVE
16X31317;MANAGER DE LA SUPPLY CHAIN ET ACHATS (MS ESC FORCE OUEST -BBS);RNCP32227;Niveau 7;;v1.0;oui;18/12/2023;ACTIVE
26031038;DIPLOME SUPERIEUR EN MARKETING, COMMERCE ET GESTION DE L'EGC VALENCE;RNCP37973;Niveau 6;DIPLOVIS;CI-09112023;oui;31/08/2026;ACTIVE
20513114;LETTRES (LIC LMD PAU);RNCP24481;Niveau 6;LICENCE;v1.0;oui;01/01/2025;ACTIVE
15531007;DIPLOME GRADE MASTER DE PARIS DAUPHINE : MANAGEMENT DES PROCESSUS DE PRODUCTION DE BIENS ET SERVICES;RNCP27426;Niveau 7;DGE_GM;v1.0;oui;31/08/2019;INACTIVE
2503261N;METIERS DE L'INFORMATIQUE : SYSTEMES D'INFORMATION ET GESTION DE DONNEES (LP TOULOUSE 3);RNCP29973;Niveau 6;Licence Professionnelle;v1.0;oui;01/01/2025;ACTIVE
26031031;BACHELOR COORDINATEUR DE PROJETS DE DEVELOPPEMENT INTERNATIONAL ET SOCIETAL DE L'ESCD3A;RNCP35843;Niveau 6;DIPLOVIS;v2.1;oui;30/08/2024;ACTIVE
13531422;COMPTABILITE-CONTROLE-AUDIT (MASTER EVRY);RNCP35991;Niveau 7;MASTER;v2.1;oui;31/08/2026;ACTIVE
2503261J;METIERS DE L'INFORMATIQUE : SYSTEMES D'INFORMATION ET GESTION DE DONNEES (LP LIMOGES);RNCP29973;Niveau 6;Licence Professionnelle;v1.0;oui;01/01/2025;ACTIVE
25023103;METIERS DU BTP : TRAVAUX PUBLICS (LP LA ROCHELLE);RNCP30144;Niveau 6;Licence Professionnelle;v1.0;oui;01/01/2025;ACTIVE
40023207;INTERVENTIONS SUR LE PATRIMOINE BATI, OPTION C COUVERTURE (BAC PRO);RNCP5534;Niveau 4;BAC PRO;v1.0;oui;01/01/2025;ACTIVE
25021004;MAINTENANCE ET TECHNOLOGIE : SYSTEMES PLURITECHNIQUES (LP DIJON);RNCP30092;Niveau 6;Licence Professionnelle;v1.0;oui;01/01/2025;ACTIVE
13531362;FINANCE (MASTER MARNE LA VALLEE;RNCP35913;Niveau 7;MASTER;v2.1;oui;31/08/2026;ACTIVE
40031110;CONDUITE ET GESTION DES ENTREPRISES MARITIMES OPTION COMMERCE (BAC PRO);RNCP2841;Niveau 4;BAC PRO;v1.0;oui;01/01/2025;ACTIVE
25034408;QUALITE, HYGIENE, SECURITE, SANTE, ENVIRONNEMENT (LP REIMS);RNCP30098;Niveau 6;Licence Professionnelle;v1.0;oui;01/01/2025;ACTIVE
50022141;PATISSIER (CAP);RNCP35316;Niveau 3;CAP;v1.6;oui;31/08/2024;ACTIVE
2503260P;METIERS DES RESEAUX INFORMATIQUES ET TELECOMMUNICATIONS (LP ANGERS);RNCP29968;Niveau 6;Licence Professionnelle;v1.0;oui;01/01/2025;ACTIVE
55321103;TRAVAUX DE PRODUCTIONS HORTICOLES SPECIALITE ARBORICULTURE FRUITIERE (BPA5);RNCP5831;Niveau 3;BPA;v1.0;oui;01/01/2025;ACTIVE
16X31406;EXPERT EN AUDIT INTERNE ET CONTROLE DE GESTION (MS TBS);RNCP36735;Niveau 7;;v2.7;oui;20/07/2027;ACTIVE
13512504;DIDACTIQUE DES LANGUES (MASTER);RNCP34841;Niveau 7;MASTER;v1.5;oui;30/06/2025;ACTIVE
13531356;MONNAIE, BANQUE, FINANCE, ASSURANCE (MASTER TOULOUSE 1);RNCP34034;Niveau 7;MASTER;v1.0;oui;31/08/2024;ACTIVE
1703260L;INGENIEUR DIPLOME DE L'ECOLE NATIONALE SUPERIEURE D'INGENIEURS DE CAEN, SPECIALITE INFORMATIQUE (ING);RNCP4378;Niveau 7;Titre ingénieur;v1.0;oui;01/01/2025;ACTIVE
36X31206;VISUAL MERCHANDISER (MJM GRAPHIC DESIGN PARIS);RNCP35088;Niveau 6;;v1.0;oui;18/11/2023;INACTIVE
25033422;ORGANISATION ET GESTION DES ETABLISSEMENTS HOTELIERS ET DE RESTAURATION (LP CERGY);RNCP29985;Niveau 6;Licence Professionnelle;v1.0;oui;01/01/2025;ACTIVE
55321102;TRAVAUX DE LA VIGNE ET DU VIN TRAVAUX DE LA VIGNE (BPA5);RNCP4892;Niveau 3;BPA;v1.0;oui;01/01/2025;ACTIVE
13512888;DROIT PUBLIC (MASTER CHAMBERY);RNCP34084;Niveau 7;MASTER;v1.0;oui;31/08/2024;ACTIVE
36X32405;ASSISTANT CHEF D'ENTREPRISE PME PMI (ROYER ROBIN ASSOCIES);RNCP34786;Niveau 5;;v1.3;oui;23/07/2022;INACTIVE
26X31105;RESP EN LOGISTIQUE DE DISTRIBUTION (OGEC MONTAIGU - ISLT);RNCP26190;Niveau 6;;v1.0;oui;23/08/2020;INACTIVE
44633526;SPECIALITE-BASKET BALL (BP JEPS);RNCP22351;Niveau 4;BP;v2.4;oui;10/10/2019;INACTIVE
32321206;AQUACULTURE (BTSA);RNCP38350;Niveau 5;BTSA;CI-07122023;oui;31/08/2029;ACTIVE
2503262X;METIERS DES RESEAUX INFORMATIQUES ET TELECOMMUNICATIONS (LP CLERMONT AUVERGNE);RNCP29968;Niveau 6;Licence Professionnelle;v1.0;oui;01/01/2025;ACTIVE
50024238;TAPISSIER-TAPISSIERE D'AMEUBLEMENT EN SIEGE (CAP);RNCP37248;Niveau 3;CAP;v2.9;oui;31/08/2027;ACTIVE
25033418;ORGANISATION ET GESTION DES ETABLISSEMENTS HOTELIERS ET DE RESTAURATION (LP MONTPELLIER);RNCP29985;Niveau 6;Licence Professionnelle;v1.0;oui;01/01/2025;ACTIVE
16031005;DIPLOME EN MANAGEMENT ET GESTION OPERATIONNELLE D'ENTREPRISE DE l'ESC AMIENS;RNCP36549;Niveau 7;DIPLOVIS;v2.6;oui;31/08/2026;ACTIVE
25023013;METIERS DU BTP : BATIMENT ET CONSTRUCTION (LP LIMOGES);RNCP30141;Niveau 6;Licence Professionnelle;v1.0;oui;01/01/2025;ACTIVE
26X31001;RESPONSABLE EN GESTION ET DEVELOPPEMENT D'ENTREPRISE (IGS ESAM);RNCP37865;Niveau 6;;CI-09112023;oui;19/07/2026;ACTIVE
26X20002;RESPONSABLE EN QUALITE SECURITE ENVIRONNEMENT (KLM-ISEAM);RNCP35977;Niveau 6;;v2.1;oui;15/10/2022;INACTIVE
16X32006;MANAGER DE LA COMMUNICATION ET DU MARKETIN DIGITAL (INSEEC);RNCP34577;Niveau 7;;v1.3;oui;24/04/2025;ACTIVE
25021417;AMENAGEMENT PAYSAGER : CONCEPTION, GESTION, ENTRETIEN (LP LIMOGES);RNCP29733;Niveau 6;Licence Professionnelle;v1.0;oui;01/01/2025;ACTIVE
32025014;MAINTENANCE DES SYSTEMES OPTION A SYSTEMES DE PRODUCTION (BTS);RNCP36968;Niveau 5;BTS;v2.8;oui;31/08/2027;ACTIVE
40025106;TECHNICIEN D'USINAGE (BAC PRO);RNCP35697;Niveau 4;BAC PRO;v1.0;oui;01/09/2025;ACTIVE
25025557;DOMOTIQUE (LP CNAM);RNCP29796;Niveau 6;Licence Professionnelle;v1.0;oui;01/01/2025;ACTIVE
25031402;METIERS DE LA GESTION ET DE LA COMPTABILITE : CONTROLE DE GESTION (LP PARIS 11);RNCP29764;Niveau 6;Licence Professionnelle;v1.0;oui;01/01/2025;ACTIVE
46321108;CONDUITE DE PRODUCTIONS MARAICHERES (CSA);RNCP34740;Niveau 4;CS;v1.3;oui;01/09/2025;ACTIVE
13531262;MARKETING, VENTE (MASTER ARTOIS);RNCP35907;Niveau 7;MASTER;v2.1;oui;31/08/2026;ACTIVE
46T23401;TECHNICIEN ETUDES EN CONSTRUCTION BOIS (TP);RNCP35181;Niveau 4;TP;v1.6;oui;29/12/2025;ACTIVE
16X31303;MANAGER DES RISQUES ET DES ASSURANCES DE L'ENTREPRISE (ESA);RNCP37349;Niveau 7;;v2.9;oui;17/02/2026;ACTIVE
46X21201;GROOM EQUIN (MFR BOURNEZEAU);RNCP37335;Niveau 4;;v2.9;oui;17/02/2025;ACTIVE
2503122T;METIERS DU MARKETING OPERATIONNEL (LP EVRY);RNCP30152;Niveau 6;Licence Professionnelle;v1.0;oui;01/01/2025;ACTIVE
50023329;MENUISIER ALUMINIUM-VERRE (CAP);RNCP37893;Niveau 3;CAP;CI-30112023;oui;31/07/2028;ACTIVE
16X31212;MANAGER DU MARKETING ET DE LA PERFORMANCE COMMERCIALE (SCIENCES-U LYON);RNCP32013;Niveau 7;;v1.0;oui;04/01/2024;ACTIVE
26X31252;RESPONSABLE COMMERCIAL TRANSPORT ET LOGISTIQUE (AFTRAL);RNCP34188;Niveau 6;;v2.7;oui;10/09/2024;ACTIVE
16X31313;MANAGER ADMINISTRATIF E FINANCIER (ECEMA);RNCP37059;Niveau 7;;v2.9;oui;23/11/2023;INACTIVE
25032052;METIERS DU NUMERIQUE : CONCEPTION, REDACTION ET REALISATION WEB (LP);RNCP29971;Niveau 6;Licence Professionnelle;v1.0;oui;01/01/2025;ACTIVE
25020035;METIERS DE L'INSTRUMENTATION, DE LA MESURE ET DU CONTROLE QUALITE (LP AIX MARSEILLE);RNCP30136;Niveau 6;Licence Professionnelle;v1.0;oui;01/01/2025;ACTIVE
36M25201;REPARATEUR-GESTIONNAIRE EN MAINTENANCE AUTOMOBILE (BM APCMA);RNCP32477;Niveau 5;;v1.4;oui;04/01/2024;ACTIVE
13512877;DROIT, ECONOMIE, GESTION : DROIT DU PATRIMOINE (MASTER MONTPELLIER);RNCP34105;Niveau 7;MASTER;v2.4;oui;31/08/2024;ACTIVE
35031004;GESTION ADMINISTRATIVE ET COMMERCIALE  DES ORGANISATIONS (DUT);RNCP20699;Niveau 5;DUT;v1.0;oui;01/01/2024;ACTIVE
20511431;SCIENCES, TECHNOLOGIES, SANTE : MATHEMATIQUES (LIC LMD UNIV BRETAGNE OCCIDENTALE);RNCP24518;Niveau 6;LICENCE;v1.1;oui;01/01/2025;ACTIVE
01034401;SURETE DES ESPACES OUVERTS AU PUBLIC (MC NIVEAU V);RNCP1177;Niveau 3;MC5;v1.0;oui;01/01/2024;ACTIVE
26X31513;CHARGE DE GESTION ET DE DEVELOPPEMENT DES RESSOURCES HUMAINES (UCO);RNCP35545;Niveau 6;;v1.7;oui;19/04/2024;ACTIVE
25032044;METIERS DE LA COMMUNICATION : CHARGE DE COMMUNICATION (LP AMIENS);RNCP30101;Niveau 6;Licence Professionnelle;v1.0;oui;01/01/2025;ACTIVE
26X33302;RESPONSABLE DE DISPOSITIFS DE FORMATION (GIP FCIP - CAFOC NANTES);RNCP36645;Niveau 6;;v2.7;oui;01/07/2024;ACTIVE
16X12805;JURISTE D'ENTREPRISE (ESGCV);RNCP36588;Niveau 7;;v2.7;oui;01/07/2025;ACTIVE
25034325;METIERS DE L'INSTRUMENTATION, DE LA MESURE ET DU CONTROLE QUALITE (LP CHAMBERY);RNCP30136;Niveau 6;Licence Professionnelle;v1.0;oui;01/01/2025;ACTIVE
13512312;SCIENCES DE L'EDUCATION (MASTER DIJON);RNCP31849;Niveau 7;MASTER;v1.1;oui;01/01/2025;ACTIVE
25021001;AGRONOMIE (LP AMIENS);RNCP30043;Niveau 6;Licence Professionnelle;v1.0;oui;01/01/2025;ACTIVE
16X32687;EXPERT EN CYBERSECURITE (PSTB - ESGCV - HETIC);RNCP37649;Niveau 7;;v3.0;oui;31/05/2026;ACTIVE
56T33201;AGENT DE MEDIATION, INFORMATION, SERVICES (TP);RNCP37722;Niveau 3;TP;CI-09112023;oui;02/07/2028;ACTIVE
26X32052;CHEF DE PROJET DIGITAL (ANDIL);RNCP36623;Niveau 6;;v2.7;oui;01/07/2024;ACTIVE
25031441;METIERS DE LA GESTION ET DE LA COMPTABILITE : COMPTABILITE ET GESTION DES ENTITES AGRICOLES (LP);RNCP29742;Niveau 6;Licence Professionnelle;v2.4;oui;01/01/2025;ACTIVE
25011807;BIOLOGIE ANALYTIQUE ET EXPERIMENTALE (LP ANGERS);RNCP30048;Niveau 6;Licence Professionnelle;v1.0;oui;01/01/2025;ACTIVE
40025302;AERONAUTIQUE OPTION AVIONIQUE (BAC PRO);RNCP37928;Niveau 4;BAC PRO;CI-09112023;oui;31/08/2028;ACTIVE
1702010R;INGENIEUR DIPLOME DE L'INSTITUT DES SCIENCES ET TECHNIQUES DES YVELINES DE L'UNIVERSITE DE VERSAILLES-SAINT QUENTIN EN YVELINES, SPECIALITE SYSTEMES ELECTRONIQUES EMBARQUES;RNCP34756;Niveau 7;Titre ingénieur;v1.6;oui;31/08/2024;ACTIVE
25031007;E-COMMERCE ET MARKETING NUMERIQUE (LP LYON 1);RNCP30060;Niveau 6;Licence Professionnelle;v1.0;oui;01/01/2025;ACTIVE
50025524;ELECTRICIEN (CAP);RNCP30328;Niveau 3;CAP;v1.0;oui;01/01/2025;ACTIVE
36T23104;TECHNICIEN GEOMETRE EN CABINET (TP);RNCP37104;Niveau 5;TP;v2.9;oui;10/02/2028;ACTIVE
2502000P;METIERS DE L'INDUSTRIE : CONCEPTION DE PRODUITS INDUSTRIELS (LP CLERMONT AUVERGNE);RNCP30125;Niveau 6;Licence Professionnelle;v1.0;oui;01/01/2025;ACTIVE
1702220M;INGENIEUR DIPLOME DE L'ECOLE NATIONALE SUPERIEURE DES INDUSTRIES CHIMIQUES DE L'UNIVERSITE DE LORRAINE;RNCP38083;Niveau 7;Titre ingénieur;CI-09112023;oui;31/08/2028;ACTIVE
26X31240;CHEF PROJET MARKETING ET COMMUNICATION (MEDIASCHOOL PARIS);RNCP36877;Niveau 6;;v2.8;oui;29/09/2024;ACTIVE
