13531336;CONTROLE DE GESTION ET AUDIT ORGANISATIONNEL (MASTER PAU);RNCP35918;Niveau 7;MASTER;v2.1;oui;31/08/2026;ACTIVE
13531017;MANAGEMENT ET ADMINISTRATION DES ENTREPRISES (MASTER BORDEAUX);RNCP35916;Niveau 7;MASTER;v2.4;oui;31/08/2026;ACTIVE
36X32616;OPERATEUR EN CYBERSECURITE (EEC);RNCP38290;Niveau 5;;CI-30112023;oui;15/11/2024;ACTIVE
36322109;FROMAGERIE INTERNATIONALE (CSA);RNCP2275;Niveau 5;CS;v1.0;oui;23/06/2020;INACTIVE
2503122H;METIERS DU COMMERCE INTERNATIONAL (LP ANGERS);RNCP30146;Niveau 6;Licence Professionnelle;v1.0;oui;01/01/2025;ACTIVE
40321004;CONDUITE ET GESTION DE L'ENTREPRISE AGRICOLE (BAC PRO AG);RNCP29267;Niveau 4;BAC PRO;v1.0;oui;01/01/2024;ACTIVE
36X32314;REGISSEUR VIDEO DE SPECTACLE (CFPTS);RNCP36531;Niveau 5;;v2.6;oui;01/06/2024;ACTIVE
1702510F;INGENIEUR DIPLOME DU CONSERVATOIRE NATIONAL DES ARTS ET METIERS SPECIALITE MECANIQUE;RNCP37360;Niveau 7;Titre ingénieur;CI-09112023;oui;31/08/2024;ACTIVE
25122207;GENIE CHIMIQUE - GENIE DES PROCEDES : CONTROLE-QUALITE, ENVIRONNEMENT ET SECURITE DES PROCEDES (BUT);RNCP35374;Niveau 6;BUT;v1.7;oui;31/08/2026;ACTIVE
40123304;ARTS GRAPHIQUES OPTION A : SIGNALETIQUE (BMA);RNCP37946;Niveau 4;BMA;CI-09112023;oui;31/08/2028;ACTIVE
36X22101;TECHNICIEN EN DEVELOPPEMENT DE PRODUITS DE BOULANGERIE-PATISSERIE (COMPAGNONS DU DEVOIR);RNCP37430;Niveau 5;;CI-09112023;oui;27/03/2026;ACTIVE
15531502;DIPLOME GRADE MASTER DE PARIS DAUPHINE : MANAGEMENT DES RESSOURCES HUMAINES;RNCP34550;Niveau 7;DGE_GM;v1.3;oui;31/08/2024;ACTIVE
35533513;ANIMATION ET GESTION DES ACTIVITES PHYSIQUES, SPORTIVES OU CULTURELLES (DEUST);RNCP35955;Niveau 5;DEUST;v2.1;oui;31/08/2026;ACTIVE
25025522;MAITRISE DE L'ENERGIE, ELECTRICITE, DEVELOPPEMENT DURABLE (LP STRASBOURG);RNCP30094;Niveau 6;Licence Professionnelle;v1.0;oui;01/01/2025;ACTIVE
17032618;INGENIEUR DIPLOME DE L'ECOLE NATIONALE SUPERIEURE D'INGENIEURS SUD-ALSACE DE L'UNIVERSITE DE MULHOUSE, SPECIALITE INFORMATIQUE ET RESEAUX;RNCP8711;Niveau 7;Titre ingénieur;v2.1;oui;01/01/2025;ACTIVE
16X20011;MANAGER DE L'AMELIORATION CONTINUE (ECAM LASALLE);RNCP37613;Niveau 7;;CI-09112023;oui;31/05/2028;ACTIVE
16X31321;EXPERT(E) EN INGENIERIE FINANCIERE (ESGCV);RNCP37421;Niveau 7;;v1.2;oui;27/03/2026;ACTIVE
26X32056;PRODUCER / CHEF DE PROJET JEU VIDEO (ISART DIGITAL);RNCP37646;Niveau 7;;v2.0;oui;31/05/2028;ACTIVE
25033522;TOURISME ET LOISIRS SPORTIFS (LP);RNCP35939;Niveau 6;Licence Professionnelle;v2.1;oui;31/08/2026;ACTIVE
16X32018;MANAGER DES STRATEGIES COMMUNICATION MARKETING (IECM - MEDIASCHOOL EXECUTIVE EDUCATION);RNCP31916;Niveau 7;;v1.0;oui;18/12/2023;ACTIVE
16C22101;MANAGER DU DEVELOPPEMENT D'AFFAIRES EN AGROBUSINESS (TECOMAH CCI PARIS IDF);RNCP37068;Niveau 7;;v2.9;oui;23/11/2027;ACTIVE
20513626;LANGUES, LITTERATURES ET CIVILISATIONS ETRANGERES ET REGIONALES (LIC LMD STRASBOURG);RNCP24508;Niveau 6;LICENCE;v1.0;oui;01/01/2025;ACTIVE
2502000Y;METIERS DE L'INDUSTRIE : INDUSTRIE NAVALE ET MARITIME (LP BRETAGNE SUD);RNCP29798;Niveau 6;Licence Professionnelle;v1.0;oui;01/01/2025;ACTIVE
26031404;DIPLOME DE RESPONSABLE D'UNITE D'AFFAIRES DE MONTPELLIER BUSINESS SCHOOL;RNCP36561;Niveau 6;DIPLOVIS;v2.9;oui;31/08/2025;ACTIVE
13531110;GESTION DE PRODUCTION, LOGISTIQUE, ACHATS (MASTER U ARTOIS);RNCP35921;Niveau 7;MASTER;v2.1;oui;31/08/2026;ACTIVE
25025531;METIERS DE L'ELECTRONIQUE : MICROELECTRONIQUE, OPTRONIQUE (LP LIMOGES);RNCP30119;Niveau 6;Licence Professionnelle;v1.0;oui;01/01/2025;ACTIVE
26X32204;GRAPHISTE MOTION DESIGNER (L'ECOLE MULTIMEDIA);RNCP37066;Niveau 6;;v2.9;oui;23/11/2024;ACTIVE
25022021;BIO-INDUSTRIES ET BIOTECHNOLOGIES (LP CLERMONT AUVERGNE);RNCP30047;Niveau 6;Licence Professionnelle;v1.0;oui;01/01/2025;ACTIVE
25031279;METIERS DU MARKETING OPERATIONNEL (LP LORRAINE);RNCP30152;Niveau 6;Licence Professionnelle;v1.0;oui;01/01/2025;ACTIVE
1353102U;ENTREPRENEURIAT ET MANAGEMENT DE PROJETS (MASTER AMIENS);RNCP35922;Niveau 7;MASTER;v2.1;oui;31/08/2026;ACTIVE
25011818;BIOLOGIE ANALYTIQUE ET EXPERIMENTALE (LP);RNCP30048;Niveau 6;Licence Professionnelle;v1.0;oui;01/01/2025;ACTIVE
44633515;SPECIALITE ACTIVITES AQUATIQUES (BP JEPS);RNCP11639;Niveau 4;BP;v1.4;oui;01/09/2018;INACTIVE
17020102;INGENIEUR DIPLOME DE L'ECOLE D'INGENIEUR DE L'UNIVERSITE DE TOULON, SPECIALITE SYSTEMES NUMERIQUES;RNCP37901;Niveau 7;Titre ingénieur;CI-09112023;oui;31/08/2028;ACTIVE
25020097;METIERS DE L'INDUSTRIE : MECATRONIQUE, ROBOTIQUE (LP STRASBOURG);RNCP30131;Niveau 6;Licence Professionnelle;v1.0;oui;01/01/2025;ACTIVE
46T22202;TECHNICIEN(NE) DE LABORATOIRE (TP);RNCP35310;Niveau 4;TP;v1.6;oui;05/06/2026;ACTIVE
46031201;COMMERCIALISATION ECO-RSPONSABLE (DSP UNIVERSITE BOURGOGNE - IUT DU CREUSOT);RNCP37213;Niveau 4;DSP;v3.0;oui;31/08/2028;ACTIVE
26X31248;RESPONSABLE DE PROJETS MARKETING COMMUNICATION (INSEEC BACHELOR);RNCP36293;Niveau 6;;v2.5;oui;25/03/2024;ACTIVE
40025223;MAINTENANCE NAUTIQUE (BAC PRO);RNCP37698;Niveau 4;BAC PRO;v3.0;oui;31/08/2028;ACTIVE
2503260N;METIERS DES RESEAUX INFORMATIQUES ET TELECOMMUNICATIONS (LP LORRAINE);RNCP29968;Niveau 6;Licence Professionnelle;v1.0;oui;01/01/2025;ACTIVE
50023223;COUVREUR (CAP);RNCP35889;Niveau 3;CAP;v2.1;oui;31/08/2026;ACTIVE
17021004;INGENIEUR DIPLOME DE L'INSTITUT SUPERIEUR D'AGRICULTURE YNCREA HAUTS-DE-FRANCE;RNCP29277;Niveau 7;Titre ingénieur;v1.0;oui;01/01/2024;ACTIVE
13520022;INGENIERIE DE CONCEPTION (MASTER);RNCP34115;Niveau 7;MASTER;v1.0;oui;31/08/2024;ACTIVE
56T23003;CONDUCTEUR D'ENGINS DE CHANTIERS URBAINS (TP);RNCP35824;Niveau 3;TP;v2.1;oui;12/10/2026;ACTIVE
13532505;SCIENCES DE L'INFORMATION ET DES BIBLIOTHEQUES (MASTER);RNCP31515;Niveau 7;MASTER;v1.0;oui;01/01/2024;ACTIVE
25013402;METIERS DE LA MEDIATION PAR DES APPROCHES ARTISTIQUES ET CULTURELLES (LP);RNCP29778;Niveau 6;Licence Professionnelle;v1.0;oui;01/01/2025;ACTIVE
46X32409;SECRETAIRE MEDICAL(E) (CENTRE PARIS EUROPE ALTERNANCE);RNCP23647;Niveau 4;;v1.3;oui;25/07/2020;INACTIVE
36C3120D;CHARGE DE LA GESTION ET DE L'ACTIVITE COMMERCIALE DE L'ENTREPRISE (CCI SEINE ET MARNE);RNCP13573;Niveau 5;;v1.0;oui;04/01/2020;INACTIVE
32020008;TECHNICO-COMMERCIAL (BTS);RNCP35801;Niveau 5;BTS;v2.0;oui;31/08/2026;ACTIVE
16X32625;EXPERT EN INFORMATIQUE ET SYSTEMES D'INFORMATION (CYBERSECURITE ET CLOUD COMPUTING, OU ARCHITECTURE BIG DATA) (IP-FORMATION - IPSSI);RNCP34567;Niveau 7;;v1.3;oui;24/04/2023;INACTIVE
45023216;MACON (BP);RNCP38303;Niveau 4;BP;CI-27112023;oui;31/08/2028;ACTIVE
26X32314;MONTEUR (EICAR);RNCP36882;Niveau 6;;v2.8;oui;29/09/2024;ACTIVE
26X32210;GRAPHISTE MULTIMEDIA (EMI);RNCP35213;Niveau 6;;v2.6;oui;20/01/2026;ACTIVE
16X31514;DIRECTEUR(TRICE) DES RESSOURCES HUMAINES (ISCG);RNCP28185;Niveau 7;;v1.0;oui;23/08/2020;INACTIVE
1351280L;DROIT DE L'ENTREPRISE (MASTER MONTPELLIER);RNCP34225;Niveau 7;MASTER;v1.0;oui;31/08/2024;ACTIVE
40023003;ARTISANAT ET METIERS D'ART OPTION MARCHANDISAGE VISUEL (BAC PRO);RNCP36335;Niveau 4;BAC PRO;v1.0;oui;31/08/2027;ACTIVE
25031084;METIERS DE LA QUALITE (LP TOULOUSE 3);RNCP30111;Niveau 6;Licence Professionnelle;v1.0;oui;01/01/2025;ACTIVE
36322107;AUTOMATISATION DANS L'INDUSTRIE LAITIERE ET AGROALIMENTAIRE (CSA);RNCP2259;Niveau 5;CS;v1.0;oui;23/06/2020;INACTIVE
46T25503;TECHNICIEN D'EQUIPEMENT ET D'EXPLOITATION EN ELECTRICITE (TP);RNCP37446;Niveau 4;TP;v1.0;oui;08/05/2028;ACTIVE
26X32069;CHEF DE PROJETS EVENEMENTIELS (EFCDE);RNCP35969;Niveau 6;;v3.0;oui;15/10/2023;INACTIVE
01025004;OPERATEUR POLYVALENT EN INTERVENTIONS SUBAQUATIQUES (MC NIVEAU IV);RNCP36816;Niveau 4;MC4;v2.7;oui;31/08/2026;ACTIVE
25011401;METIERS DU DECISIONNEL ET DE LA STATISTIQUE (LP LYON 2);RNCP29969;Niveau 6;Licence Professionnelle;v1.0;oui;01/01/2025;ACTIVE
46321106;PRODUCTION CIDRICOLE (CSA);RNCP2280;Niveau 4;CS;v1.0;oui;01/01/2024;ACTIVE
01025118;REALISATION DE CIRCUITS OLEOHYDRAULIQUES ET PNEUMATIQUES (MC NIVEAU V);RNCP36333;Niveau 3;MC5;v2.7;oui;31/08/2026;ACTIVE
44633529;SPECIALITE EDUCATEUR SPORTIF, MENTION VOLLEY BALL ET DISCIPLINES ASSOCIEES (BP JEPS);RNCP36823;Niveau 4;BPJEPS;CI-14122023;oui;08/09/2027;ACTIVE
13511602;CHIMIE ET SCIENCES DES MATERIAUX (MASTER EVRY);RNCP34112;Niveau 7;MASTER;v1.1;oui;31/08/2024;ACTIVE
16X32641;DATA SCIENTIST (OPEN CLASSROOMS);RNCP37431;Niveau 7;;v1.3;oui;27/03/2025;ACTIVE
25132610;RESEAUX ET TELECOMMUNICATIONS : INTERNET DES OBJETS ET MOBILITE (BUT);RNCP35457;Niveau 6;BUT;v1.7;oui;31/08/2026;ACTIVE
25031105;MANAGEMENT DES PROCESSUS LOGISTIQUES (LP MULHOUSE);RNCP29992;Niveau 6;Licence Professionnelle;v1.0;oui;01/01/2025;ACTIVE
26C31101;RESPONSABLE LOGISTIQUE (CCI FRANCE RESEAU RLOG);RNCP37080;Niveau 6;;v2.9;oui;23/11/2027;ACTIVE
45024005;MAINTENANCE DES ARTICLES TEXTILES OPTION PRESSING (BP);RNCP35807;Niveau 4;BAC PRO;v2.0;oui;31/08/2026;ACTIVE
25031075;MANAGEMENT ET GESTION DES ORGANISATIONS (LP TOULOUSE 1);RNCP30086;Niveau 6;Licence Professionnelle;v1.0;oui;01/01/2025;ACTIVE
16X31510;DIRECTEUR DES RESSOURCES HUMAINES (CARREL FORMATION CONTINUE);RNCP28768;Niveau 7;;v1.0;oui;05/08/2020;INACTIVE
32132208;ARTS GRAPHIQUES OPTION : TYPOGRAPHIE (DMA);RNCP829;Niveau 5;DMA;v1.0;oui;01/01/2025;ACTIVE
2503123J;GESTION DES ACHATS ET DES APPROVISIONNEMENTS (LP);RNCP30065;Niveau 6;Licence Professionnelle;v1.0;oui;01/01/2025;ACTIVE
56T25002;ELECTROMECANICIEN DE MAINTENANCE INDUSTRIELLE (TP);RNCP37276;Niveau 3;TP;v2.9;oui;22/02/2028;ACTIVE
50022419;FABRICATION INDUSTRIELLE DES CERAMIQUES (CAP);RNCP579;Niveau 3;CAP;v1.0;oui;01/01/2025;ACTIVE
56X33101;AGENT THERMAL (CONSEIL NATIONAL DES ETABLISSEMENTS THERMAUX);RNCP34518;Niveau 3;;v2.2;oui;30/03/2022;INACTIVE
13522109;NUTRITION ET SCIENCES DES ALIMENTS (MASTER);RNCP28876;Niveau 7;MASTER;v2.1;oui;01/09/2022;INACTIVE
26X31526;CHARGE DE GESTION EN RESSOURCES HUMAINES (SIENCES-U LYON);RNCP36668;Niveau 6;;v2.7;oui;01/07/2024;ACTIVE
56T25412;SOUDEUR ASSEMBLEUR INDUSTRIEL (TP);RNCP34502;Niveau 3;TP;v1.9;oui;28/02/2025;ACTIVE
46X33004;SOCIO COIFFEUR (SOCO ACADEMY);RNCP20334;Niveau 4;;v2.4;oui;21/12/2022;INACTIVE
17022007;INGENIEUR DIPLOME DE L'INSTITUT SUPERIEUR DES MATERIAUX DU MANS;RNCP4220;Niveau 7;Titre ingénieur;v1.9;oui;01/01/2025;ACTIVE
2503122A;COMMERCE ET DISTRIBUTION (LP ANGERS);RNCP29740;Niveau 6;Licence Professionnelle;v1.0;oui;01/01/2025;ACTIVE
16X21101;MANAGER DE DOMAINES VITICOLES (MS BORDEAUX SCIENCES AGRO);RNCP19182;Niveau 7;;v2.5;oui;18/12/2023;ACTIVE
25022134;INDUSTRIES AGROALIMENTAIRES : GESTION, PRODUCTION ET VALORISATION (LP BORDEAUX);RNCP30074;Niveau 6;Licence Professionnelle;v1.0;oui;01/01/2025;ACTIVE
17025012;INGENIEUR DIPLOME DE L'ECOLE CATHOLIQUE D'ARTS ET METIERS DE LA FONDATION ECAM SPECIALITE GENIE INDUSTRIEL ET MECANIQUE;RNCP4622;Niveau 7;Titre ingénieur;v1.0;oui;01/01/2025;ACTIVE
46333402;TOURISME VERT ACCUEIL ET ANIMATION EN MILIEU RURAL (CSA);RNCP2307;Niveau 4;CS;v1.0;oui;01/01/2025;ACTIVE
25034112;METIERS DE L'AMENAGEMENT DU TERRITOIRE ET DE L'URBANISME (LP LILLE 1);RNCP30115;Niveau 6;Licence Professionnelle;v1.0;oui;01/01/2025;ACTIVE
25011801;BIOLOGIE ANALYTIQUE ET EXPERIMENTALE (LP TOURS);RNCP30048;Niveau 6;Licence Professionnelle;v1.0;oui;01/01/2025;ACTIVE
25011103;CHIMIE ET PHYSIQUE DES MATERIAUX (LP LIMOGES);RNCP30053;Niveau 6;Licence Professionnelle;v1.0;oui;01/01/2025;ACTIVE
25021419;AMENAGEMENT PAYSAGER : CONCEPTION, GESTION, ENTRETIEN (LP);RNCP29733;Niveau 6;Licence Professionnelle;v1.0;oui;01/01/2025;ACTIVE
13531273;MARKETING, VENTE (MASTER LA ROCHELLE);RNCP35907;Niveau 7;MASTER;v2.1;oui;31/08/2026;ACTIVE
32022711;FLUIDES-ENERGIES-DOMOTIQUE OPTION C DOMOTIQUE ET BATIMENTS COMMUNICANTS (BTS);RNCP38361;Niveau 5;BTS;CI-13122023;oui;31/12/2028;ACTIVE
1702410B;INGENIEUR DIPLOME DE L'ECOLE SUPERIEURE DES ARTS ET INDUSTRIES TEXTILES;RNCP24412;Niveau 7;Titre ingénieur;v1.0;oui;01/01/2025;ACTIVE
13531207;MANAGEMENT ET COMMERCE INTERNATIONAL (MASTER LE HAVRE);RNCP35915;Niveau 7;MASTER;v2.4;oui;31/08/2026;ACTIVE
25031091;METIERS DE L'ENTREPRENEURIAT (LP PARIS 13);RNCP30122;Niveau 6;Licence Professionnelle;v1.0;oui;01/01/2025;ACTIVE
25032308;TECHNIQUES DU SON ET DE L'IMAGE (LP EVRY);RNCP30164;Niveau 6;Licence Professionnelle;v1.0;oui;01/01/2025;ACTIVE
25020050;MAINTENANCE DES SYSTEMES INDUSTRIELS DE PRODUCTION ET D'ENERGIE (LP MARNE LA VALLEE);RNCP30088;Niveau 6;Licence Professionnelle;v1.0;oui;01/01/2025;ACTIVE
16024002;DIPLOME DE MANAGER MODE ET LUXE DE L'INSTITUT FRANCAIS DE LA MODE;RNCP37666;Niveau 7;DIPLOVIS;v1.0;oui;31/08/2024;ACTIVE
16512801;DIPLOME GRADE MASTER DE L'INSTITUT D'ETUDES POLITIQUES DE BORDEAUX;RNCP34024;Niveau 7;Grade_Master;v1.9;oui;01/09/2024;ACTIVE
36033105;PUERICULTRICE;RNCP34861;Niveau 6;DE;v1.6;oui;01/01/2024;ACTIVE
16X31236;MANAGER OPTION RETAIL OU WHOLESALE;RNCP35199;Niveau 7;;v1.7;oui;20/01/2024;ACTIVE
25122201;CHIMIE : ANALYSE, CONTROLE-QUALITE, ENVIRONNEMENT (BUT);RNCP35494;Niveau 6;BUT;v1.7;oui;31/08/2026;ACTIVE
25034334;GENIE DES PROCEDES POUR L'ENVIRONNEMENT (LP MONTPELLIER);RNCP30063;Niveau 6;Licence Professionnelle;v1.0;oui;01/01/2025;ACTIVE
50023326;METIERS DU PLATRE ET DE L'ISOLATION (CAP);RNCP35319;Niveau 3;CAP;v1.6;oui;31/08/2024;ACTIVE
25132603;INFORMATIQUE : DEVELOPPEMENT DEPLOIEMENT D'APPLICATIONS COMMUNICANTES ET SECURISEES (BUT);RNCP35476;Niveau 6;BUT;v1.7;oui;31/08/2026;ACTIVE
26X31106;RESPONSABLE OPERATIONNEL DE LA CHAINE LOGISTIQUE (ESPL);RNCP35869;Niveau 6;;v2.1;oui;15/09/2024;ACTIVE
46T32404;SECRETAIRE ASSISTANT(E) IMMOBILIER (TP);RNCP34441;Niveau 5;TP;v1.3;oui;07/01/2025;ACTIVE
17034302;INGENIEUR DIPLOME DE L'ECOLE POLYTECHNIQUE UNIVERSITAIRE DE MONTPELLIER DE L'UNIVERSITE DE MONTPELLIER, SPECIALITE GENIE DE L'EAU;RNCP35565;Niveau 7;Titre ingénieur;v1.7;oui;31/08/2025;ACTIVE
17033103;INGENIEUR DIPLOME DE L'ECOLE D'INGENIEURS DENIS-DIDEROT DE L'UNIVERSITE DE PARIS, SPECIALITE GENIE BIOLOGIQUE;RNCP36672;Niveau 7;Titre ingénieur;v2.7;oui;31/08/2024;ACTIVE
16X33107;RESPONSABLE EN MANAGEMENT ET DEVELOPPEMENT D'ENTREPRISE DE SANTE (KLM - ISEAM);RNCP36699;Niveau 7;;v2.7;oui;20/07/2025;ACTIVE
16X31054;MANAGER DIGITAL (MS ESSCA);RNCP35198;Niveau 7;;v2.4;oui;20/01/2024;ACTIVE
25132602;INFORMATIQUE : ADMINISTRATION, GESTION ET EXPLOITATION DES DONNEES (BUT);RNCP35477;Niveau 6;BUT;v1.7;oui;31/08/2026;ACTIVE
50022340;ORFEVRE OPTION A : MONTEUR EN ORFEVRERIE (CAP);RNCP640;Niveau 3;CAP;v1.0;oui;01/01/2025;ACTIVE
2502001W;METIERS DE L'EMBALLAGE ET DU CONDITIONNEMENT (LP);RNCP30120;Niveau 6;Licence Professionnelle;v1.0;oui;01/01/2025;ACTIVE
25031375;ASSURANCE, BANQUE, FINANCE : CHARGE DE CLIENTELE (LP ROUEN);RNCP30181;Niveau 6;Licence Professionnelle;v1.0;oui;01/01/2025;ACTIVE
50022349;BRONZIER OPTION A : MONTEUR EN BRONZE (CAP);RNCP530;Niveau 3;CAP;v1.0;oui;01/01/2025;ACTIVE
40021204;CULTURES MARINES (BAC PRO);RNCP2846;Niveau 4;BAC PRO;v1.0;oui;01/01/2025;ACTIVE
32322115;ANALYSES BIOLOGIQUES, BIOTECHNOLOGIQUES, AGRICOLES ET ENVIRONNEMENTALES (BTSA);RNCP36772;Niveau 5;BTSA;V2.8;oui;31/08/2028;ACTIVE
26X33101;RESPONSABLE EN REFRACTION ET EQUIPEMENT OPTIQUE (ISV);RNCP6963;Niveau 6;;v1.0;oui;25/07/2020;INACTIVE
25034501;METIERS DU NOTARIAT (LP CHAMBERY);RNCP30153;Niveau 6;Licence Professionnelle;v1.0;oui;01/01/2025;ACTIVE
16X31520;MANAGER EN RESSOURCES HUMAINES (EM NORMANDIE);RNCP19222;Niveau 7;;v1.2;oui;04/01/2021;INACTIVE
26X32051;CONCEPTEUR WEBDESIGNER (SUPCREA GRENOBLE);RNCP34245;Niveau 6;;v1.8;oui;10/10/2024;ACTIVE
26X32015;CHARGE DE COMMUNICATION PLURIMEDIA (FORMATIVES);RNCP34589;Niveau 6;;v1.3;oui;24/04/2025;ACTIVE
20513104;LETTRES (LIC LMD LIMOGES);RNCP24481;Niveau 6;LICENCE;v1.0;oui;01/01/2025;ACTIVE
17025514;INGENIEUR DIPLOME DE L'ECOLE NATIONALE SUPERIEURE D'INGENIEURS DE CAEN, SPECIALITE GENIE PHYSIQUE ET SYSTEMES EMBARQUES;RNCP4286;Niveau 7;Titre ingénieur;v1.0;oui;01/01/2025;ACTIVE
46321213;PRODUCTION,TRANSFORMATION ET COMMERCIALISATION DES PRODUITS FERMIERS (CSA);RNCP2281;Niveau 4;CS;v1.0;oui;01/01/2025;ACTIVE
26X33401;RESPONSABLE EN CUISINE ET RESTAURATION (INSTITUT PAUL BOCUSE);RNCP35647;Niveau 6;DIPLOVIS;v1.0;non;31/08/2023;INACTIVE
16X31064;MANAGER DU DEVELOPPEMENT DANS LA FILIERE VINS ET SPIRITUEUX (GROUPE KEDGE BUSINESS SCHOOL);RNCP37074;Niveau 7;;v2.9;oui;23/11/2027;ACTIVE
25031139;METIERS DE L'INDUSTRIE : LOGISTIQUE INDUSTRIELLE (LP);RNCP32203;Niveau 6;Licence Professionnelle;v1.0;oui;01/01/2025;ACTIVE
2503261L;METIERS DE L'INFORMATIQUE : CONCEPTION, DEVELOPPEMENT ET TEST DE LOGICIELS (LP LYON 1);RNCP29966;Niveau 6;Licence Professionnelle;v1.0;oui;01/01/2025;ACTIVE
25022016;MAINTENANCE ET TECHNOLOGIE : CONTROLE INDUSTRIEL (LP LE MANS);RNCP30089;Niveau 6;Licence Professionnelle;v1.0;oui;01/01/2025;ACTIVE
20513116;LETTRES (LIC LMD LORRAINE);RNCP24481;Niveau 6;LICENCE;v1.0;oui;01/01/2025;ACTIVE
26X32022;CHARGE(E) DE PROJET DE COMMUNICATION DIGITALE (ISCG);RNCP28186;Niveau 6;;v1.0;oui;23/08/2020;INACTIVE
16X22201;MANAGER DES PROCESS DE CREATION ET DE DEVELOPPEMENT DES PRODUITS PARFUM, COSMETIQUE ET AROMES (CCIP, ISIPCA);RNCP37789;Niveau 7;;CI-09112023;oui;19/07/2028;ACTIVE
36X33505;ENTRAINEUR DE FOOTBALL (FFF);RNCP37758;Niveau 5;;CI-09112023;oui;19/07/2026;ACTIVE
26S33201;RESPONSABLE D'ENTREPRISE D'ECONOMIE SOCIALE ET SOLIDAIRE (AROBASE);RNCP36867;Niveau 6;;v2.8;oui;29/09/2025;ACTIVE
56T25408;SOUDEUR ASSEMBLEUR INDUSTRIEL (TP);RNCP34502;Niveau 3;TP;v1.3;oui;28/02/2025;ACTIVE
13531530;INTERVENTION ET DEVELOPPEMENT SOCIAL (MASTER MONTPELLIER 3);RNCP34132;Niveau 7;MASTER;v1.0;oui;31/08/2024;ACTIVE
32321401;AMENAGEMENTS PAYSAGERS (BTSA);RNCP38349;Niveau 5;BTSA;CI-07122023;oui;31/08/2029;ACTIVE
25023014;METIERS DU BTP : GENIE CIVIL ET CONSTRUCTION (LP BORDEAUX);RNCP30142;Niveau 6;Licence Professionnelle;v1.0;oui;01/01/2025;ACTIVE
13511306;SCIENCES DE L'EAU (MASTER);RNCP34097;Niveau 7;MASTER;v1.0;oui;31/08/2024;ACTIVE
16X12803;DELEGUE A LA PROTECTION DES DONNEES (LA PLATEFORME FORMATION);RNCP36046;Niveau 7;;v2.3;oui;24/11/2024;ACTIVE
1353261R;TRAITEMENT DU SIGNAL ET DES IMAGES (MASTER);RNCP30286;Niveau 7;MASTER;v1.8;oui;01/01/2025;ACTIVE
32033425;MANAGEMENT EN HOTELLERIE-RESTAURATION OPTION C MANAGEMENT D'UNITE D'HEBERGEMENT (BTS);RNCP37889;Niveau 5;BTS;CI-09112023;oui;31/08/2028;ACTIVE
17025510;INGENIEUR DIPLOME DE L'ECOLE POLYTECHNIQUE UNIVERSITAIRE DE L'UNIVERSITE DE NANTES, SPECIALITE ELECTRONIQUE ET TECHNOLOGIES NUMERIQUES;RNCP37600;Niveau 7;Titre ingénieur;v2.4;oui;31/08/2026;ACTIVE
20513127;LETTRES (LIC LMD UNIV BRETAGNE OCCIDENTALE);RNCP24481;Niveau 6;LICENCE;v1.0;oui;01/01/2025;ACTIVE
26K32501;DOCUMENTALISTE MULTIMEDIAS (INA);RNCP23812;Niveau 6;;v1.0;oui;25/07/2020;INACTIVE
50023442;MENUISIER INSTALLATEUR (CAP);RNCP35974;Niveau 3;CAP;v2.1;oui;31/08/2026;ACTIVE
17022101;INGENIEUR DIPLOME DE L'ECOLE SUPERIEURE D'INGENIEURS EN AGROALIMENTAIRE DE BRETAGNE ATLANTIQUE DE L'UNIVERSITE DE BREST, SPECIALITE AGROALIMENTAIRE;RNCP35789;Niveau 7;Titre ingénieur;v2.4;oui;31/07/2026;ACTIVE
26X32061;UX DESIGNER (L'ECOLE MULTIMEDIA);RNCP36289;Niveau 6;;v2.5;oui;25/03/2025;ACTIVE
25033506;METIERS DE LA MEDIATION PAR DES APPROCHES ARTISTIQUES ET CULTURELLES (LP LA REUNION);RNCP29778;Niveau 6;Licence Professionnelle;v1.0;oui;01/01/2025;ACTIVE
25033124;METIERS DE LA PROMOTION DES PRODUITS DE SANTE (LP MONTPELLIER);RNCP30097;Niveau 6;Licence Professionnelle;v1.0;oui;01/01/2025;ACTIVE
50023321;ETANCHEUR DU BATIMENT ET DES TRAVAUX PUBLICS (CAP);RNCP1141;Niveau 3;CAP;v1.0;oui;31/08/2023;INACTIVE
50034405;AGENT DE SECURITE (CAP);RNCP38226;Niveau 3;CAP;CI-27112023;oui;31/08/2027;ACTIVE
32025302;AERONAUTIQUE (BTS);RNCP37706;Niveau 5;BTS;CI-09112023;oui;31/08/2028;ACTIVE
25022136;BIO-INDUSTRIES ET BIOTECHNOLOGIES (LP GRENOBLE ALPES);RNCP30047;Niveau 6;Licence Professionnelle;v1.0;oui;01/01/2025;ACTIVE
25031006;QUALITE, HYGIENE, SECURITE, SANTE, ENVIRONNEMENT (LP EVRY);RNCP30098;Niveau 6;Licence Professionnelle;v1.0;oui;01/01/2025;ACTIVE
25020095;METIERS DE L'INDUSTRIE : INDUSTRIE NAVALE ET MARITIME (LP NANTES);RNCP29798;Niveau 6;Licence Professionnelle;v1.0;oui;01/01/2025;ACTIVE
25020120;METIERS DE L'INSTRUMENTATION, DE LA MESURE ET DU CONTROLE QUALITE (LP LORRAINE);RNCP30136;Niveau 6;Licence Professionnelle;v1.0;oui;01/01/2025;ACTIVE
45024216;VETEMENT SUR MESURE OPTION TAILLEUR HOMME (BP);RNCP37937;Niveau 4;BP;CI-09112023;oui;31/08/2026;ACTIVE
26521002;AGRICULTURE, NUMERIQUE ET TECHNOLOGIES EMBARQUEES (BACHELOR EN SCIENCES ET INGENIERIE UNILASALLE);RNCP36681;Niveau 6;Grade_Licence;V2.8;oui;31/08/2024;ACTIVE
35533510;ANIMATION ET GESTION DES ACTIVITES PHYSIQUES ET SPORTIVES OU CULTURELLES (DEUST BESANCON);RNCP35955;Niveau 5;DEUST;v2.1;oui;31/08/2026;ACTIVE
2503122X;COMMERCE ET DISTRIBUTION (LP ANTILLES);RNCP29740;Niveau 6;Licence Professionnelle;v1.0;oui;01/01/2025;ACTIVE
46X32407;SECRETAIRE MEDICAL - SECRETAIRE MEDICO-SOCIAL (CROIX ROUGE FRANCAISE);RNCP36080;Niveau 4;;v2.3;oui;15/12/2026;ACTIVE
17025110;INGENIEUR DIPLOME DE L'ECOLE POLYTECHNIQUE UNIVERSITAIRE DE MONTPELLIER, SPECIALITE MECANIQUE;RNCP35927;Niveau 7;Titre ingénieur;v2.1;oui;31/08/2025;ACTIVE
46T31101;TECHNICIEN(NE) EN LOGISTIQUE D'ENTREPOSAGE (TP);RNCP36237;Niveau 4;TP;v2.4;oui;21/04/2027;ACTIVE
50023323;PLATRIER-PLAQUISTE (CAP);RNCP35319;Niveau 3;CAP;v1.6;oui;31/08/2024;ACTIVE
32024110;DESIGN DE MODE, TEXTILE ET ENVIRONNEMENT OPTION B : TEXTILE-MATERIAUX-SURFACE (BTS);RNCP822;Niveau 5;BTS;v1.0;oui;31/08/2021;INACTIVE
32025017;MAINTENANCE DES SYSTEMES OPTION D SYSTEMES ASCENSEURS ET ELEVATEURS (BTS);RNCP36968;Niveau 5;BTS;v2.8;oui;31/08/2027;ACTIVE
17032610;INGENIEUR DIPLOME TELECOM SUD PARIS DE L'INSTITUT MINES TELECOM SPECIALITE RESEAUX;RNCP17469;Niveau 7;Titre ingénieur;v1.0;oui;01/01/2025;ACTIVE
50024130;ARTS DE LA DENTELLE OPTION FUSEAUX (CAP);RNCP35640;Niveau 3;CAP;v1.9;oui;31/08/2026;ACTIVE
13512009;ETUDES SUR LE GENRE (MASTER);RNCP31494;Niveau 7;MASTER;v1.0;oui;01/01/2025;ACTIVE
50023121;CONDUCTEUR D'ENGINS DE TRAVAUX PUBLICS ET CARRIERES (CAP);RNCP37891;Niveau 3;CAP;CI-30112023;oui;31/08/2028;ACTIVE
20520005;SCIENCES, TECHNOLOGIES, SANTE : SCIENCES POUR L'INGENIEUR (LIC LMD MARNE LA VALLEE);RNCP24538;Niveau 6;LICENCE;v1.1;oui;01/01/2025;ACTIVE
50031117;"CONDUCTEUR ROUTIER ""MARCHANDISES"" (CAP)";RNCP37894;Niveau 3;CAP;CI-09112023;oui;31/08/2028;ACTIVE
16X32038;MANAGER DU CONTENU - CONTENT MANAGER (SUP DE PUB);RNCP37776;Niveau 7;;CI-09112023;oui;19/07/2026;ACTIVE
17021014;INGENIEUR DIPLOME DE L'INSTITUT NATIONAL D'ENSEIGNEMENT SUPERIEUR DES SCIENCES AGRONOMIQUES, DE L'ALIMENTATION ET DE L'ENVIRONNEMENT, SPECIALITE AGRONOMIE;RNCP11432;Niveau 7;Titre ingénieur;v2.3;oui;01/01/2025;ACTIVE
13513616;LANGUES ETRANGERES APPLIQUEES (MASTER DIJON);RNCP34101;Niveau 7;MASTER;v1.0;oui;31/08/2024;ACTIVE
2503261W;METIERS DU DECISIONNEL ET DE LA STATISTIQUE (CNAM);RNCP29969;Niveau 6;Licence Professionnelle;v1.0;oui;01/01/2025;ACTIVE
24631303;EVALUATEUR IMMOBILIER (CNAM);RNCP24860;Niveau 6;;v1.2;oui;03/12/2020;INACTIVE
15512202;DIPLOME GRADE MASTER DE PARIS DAUPHINE : AFFAIRES INTERNATIONALES ET DEVELOPPEMENT;RNCP34547;Niveau 7;DGE_GM;v1.3;oui;31/08/2024;ACTIVE
50022133;CHOCOLATIER CONFISEUR (CAP);RNCP37303;Niveau 3;CAP;v2.9;oui;31/08/2026;ACTIVE
17020053;INGENIEUR DIPLOME DE L'ECOLE NATIONALE SUPERIEURE EN GENIE DES SYSTEMES ET DE L'INNOVATION DE L'UNIVERSITE DE LORRAINE;RNCP37543;Niveau 7;Titre ingénieur;v3.0;oui;31/08/2028;ACTIVE
46T22710;TECHNICIEN FROID EMBARQUE ROUTIER (TP);RNCP36242;Niveau 4;TP;V2.8;oui;22/04/2027;ACTIVE
50025440;CARROSSIER AUTOMOBILE (CAP);RNCP37601;Niveau 3;CAP;CI-07122023;oui;31/08/2028;ACTIVE
25031268;METIERS DU COMMERCE INTERNATIONAL (LP MARNE LA VALLEE);RNCP30146;Niveau 6;Licence Professionnelle;v1.0;oui;01/01/2025;ACTIVE
55322102;TRANSFORMATIONS ALIMENTAIRES TRANSFORMATION DU LAIT (BPA5);RNCP7580;Niveau 3;BPA;v1.0;oui;01/01/2025;ACTIVE
16X32012;DIRECTEUR(TRICE) DE CREATION EN DESIGN GRAPHIQUE (ASSOCIATION CAMPUS FONDERIE DE L'IMAGE);RNCP37520;Niveau 7;;v1.0;oui;24/04/2025;ACTIVE
16X31319;MANAGER DE L'HABITAT SOCIAL ET DURABLE (GROUPE CONSEIL ASSURANCES FORMATION);RNCP35590;Niveau 7;;v1.8;oui;19/05/2026;ACTIVE
40123410;TECHNICIEN EN FACTURE INSTRUMENTALE OPTION GUITARE (BMA);RNCP36340;Niveau 4;BMA;v1.0;oui;31/08/2027;ACTIVE
17025511;INGENIEUR DIPLOME DE L'ECOLE NATIONALE SUPERIEURE DES MINES DE SAINT-ETIENNE DE L'INSTITUT MINES-TELECOM SPE SYSTEMES ELECTRONIQUES EMBARQUES;RNCP35831;Niveau 7;Titre ingénieur;v2.0;oui;30/09/2025;ACTIVE
32330001;DEVELOPPEMENT, ANIMATION DES TERRITOIRES RURAUX (BTSA);RNCP15668;Niveau 5;BTSA;v1.0;oui;01/01/2025;ACTIVE
50023117;CONSTRUCTEUR EN OUVRAGES D'ART (CAP);RNCP34742;Niveau 3;CAP;v1.3;oui;31/08/2024;ACTIVE
46C25501;TECHNICIEN RESEAUX ET SERVICE TRES HAUT DEBIT (INNOVANCE);RNCP37336;Niveau 4;;v1.0;oui;17/02/2025;ACTIVE
1351282E;DROIT DES LIBERTES (MASTER);RNCP34083;Niveau 7;MASTER;CI-09112023;oui;31/08/2024;ACTIVE
13511610;CHIMIE (MASTER POITIERS);RNCP31803;Niveau 7;MASTER;v1.0;oui;01/01/2025;ACTIVE
46X33603;CONSEILLER DE VENTE OMNICANALE DE POINT DE VENTE SPECIALISE MODE ET BEAUTE (FB FORMATION EMA SUP);RNCP35759;Niveau 4;;v2.0;oui;08/07/2024;ACTIVE
1702000H;INGENIEUR DIPLOME DE L'ECOLE SUPERIEURES D'INGENIEURS DE PARIS-EST DE L'UNIVERSITE DE MARNE LA VALLEE SPECIALITE MAINTENANCE ET FIABILITE DES PROCESSUS INDUSTRIELS;RNCP25645;Niveau 7;Titre ingénieur;v2.0;oui;01/01/2025;ACTIVE
26X31014;RESPONSABLE INTERNATIONAL(E) EN MARKETING DEVELOPPEMENT (MBA INSTITUTE - INSEEC);RNCP36294;Niveau 6;;v2.6;oui;25/03/2024;ACTIVE
17020040;INGENIEUR DIPLOME DE L'ECOLE NATIONALE SUPERIEURE DE TECHNIQUES AVANCEES;RNCP12231;Niveau 7;Titre ingénieur;v1.0;oui;01/01/2025;ACTIVE
2502002W;METIERS DE L'INDUSTRIE : INDUSTRIE NAVALE ET MARITIME (LP);RNCP29798;Niveau 6;Licence Professionnelle;v1.0;oui;01/01/2025;ACTIVE
16X31050;MANAGER DES ORGANISATIONS (CDE FEDE FRANCE);RNCP35280;Niveau 7;;v1.7;oui;10/02/2026;ACTIVE
25022154;INDUSTRIES AGROALIMENTAIRES : GESTION, PRODUCTION ET VALORISATION (LP CNAM);RNCP30074;Niveau 6;Licence Professionnelle;v1.0;oui;01/01/2025;ACTIVE
25033117;QUALITE, HYGIENE, SECURITE, SANTE, ENVIRONNEMENT (LP CERGY);RNCP30098;Niveau 6;Licence Professionnelle;v1.0;oui;01/01/2025;ACTIVE
01025122;MAQUETTES ET PROTOTYPES (MC NIVEAU IV);RNCP38304;Niveau 4;MC4;CI-30112023;oui;31/08/2028;ACTIVE
25031351;ASSURANCE, BANQUE, FINANCE : CHARGE DE CLIENTELE (LP CAEN);RNCP30181;Niveau 6;Licence Professionnelle;v1.0;oui;01/01/2025;ACTIVE
